tweet_id,text,name,jpg_url,favorite_count,retweet_count,user_count,dog_stage,date,time,rating,dog_breed,conf_lvl
731285275100512256,This is Solomon. He's a Beneroo Cumberflop. 12/10 would hug passionately https://t.co/5phLAnGPTP,Solomon,https://pbs.twimg.com/media/ChQRsYaW0AETD7z.jpg,6682.0,2234.0,3200944.0,,2016-05-14,00:49:30,12.0,standard_poodle,0.261112
731156023742988288,Say hello to this unbelievably well behaved squad of doggos. 204/170 would try to pet all at once https://t.co/yGQI3He3xv,None,https://pbs.twimg.com/media/ChY2aHyWMAAbNQE.jpg,5407.0,2435.0,3200944.0,doggo,2016-05-13,16:15:54,12.0,miniature_pinscher,0.255327
730924654643314689,We only rate dogs. Pls stop sending non-canines like this Bulgarian Eyeless Porch Bear. This is unacceptable... 9/10 https://t.co/2yctWAUZ3Z,None,https://pbs.twimg.com/media/ChZr8SdWIAAVQKt.jpg,3809.0,1176.0,3200944.0,,2016-05-13,00:56:32,9.0,soft-coated_wheaten_terrier,0.5159189999999999
730573383004487680,This is Rooney. He can't comprehend glass. 10/10 it'll be ok pupper https://t.co/CnUl2uDBBV,Rooney,https://pbs.twimg.com/media/ChaXmuAXEAE66KP.jpg,4180.0,1182.0,3200944.0,pupper,2016-05-12,01:40:42,10.0,toy_poodle,0.083749
730427201120833536,This is Crystal. She's flawless. Really wants to be a frat bro. 11/10 who does she even know here? https://t.co/WyqNFvEulG,Crystal,https://pbs.twimg.com/media/ChdyJvdWwAA5HGd.jpg,5339.0,2172.0,3200944.0,,2016-05-11,15:59:50,11.0,flat-coated_retriever,0.656463
730211855403241472,This is Ziva. She doesn't know how her collar works. 11/10 would totally fix for her https://t.co/K7pthJXjWE,Ziva,https://pbs.twimg.com/media/ChfXDrGUkAEAtF-.jpg,4396.0,1268.0,3200944.0,,2016-05-11,01:44:07,11.0,Chihuahua,0.0705542
730196704625098752,This is Charles. He's camera shy. Tail longer than average. Doesn't look overwhelmingly fluffy. 6/10 would still pet https://t.co/rXvcElhoog,Charles,https://pbs.twimg.com/media/Chfwmd9U4AQTf1b.jpg,1856.0,431.0,3200944.0,,2016-05-11,00:43:55,6.0,toy_poodle,0.827469
729854734790754305,Say hello to Ollie. He conducts this train. He also greets you as you enter. Kind af. 11/10 would pet so firmly https://t.co/jVxOGKEU0z,Ollie,https://pbs.twimg.com/media/Chiv6BAW4AAiQvH.jpg,4358.0,1390.0,3200944.0,,2016-05-10,02:05:03,11.0,Pomeranian,0.958834
729838605770891264,"""Challenge completed"" 
(pupgraded to 12/10) https://t.co/85dTK7XCXB",None,https://pbs.twimg.com/media/Chkc1BQUoAAa96R.jpg,6340.0,2586.0,3200944.0,,2016-05-10,01:00:58,12.0,Great_Pyrenees,0.457164
729823566028484608,This is Stefan. He's a downright remarkable pup. 13/10 https://t.co/Ebjt6Y4fMh,Stefan,https://pbs.twimg.com/media/ChlCQg-VIAQ_8g4.jpg,2054.0,370.0,3200944.0,,2016-05-10,00:01:12,13.0,Border_collie,0.462408
729463711119904772,Meet Pupcasso. You can't afford his art. 13/10 talented af https://t.co/f2VUpy4WO0,Pupcasso,https://pbs.twimg.com/media/ChpuRyvVAAARMoq.jpg,3460.0,917.0,3200944.0,,2016-05-09,00:11:16,13.0,cocker_spaniel,0.384559
729113531270991872,"""Challenge accepted""
10/10 https://t.co/vNjvr5Bl9u",None,https://pbs.twimg.com/media/ChqARqmWsAEI6fB.jpg,5090.0,1911.0,3200944.0,,2016-05-08,00:59:46,10.0,Pomeranian,0.248664
728986383096946689,"This is Puff. He started out on the streets (first pic), but don't let the new smile fool you, still tough af. 11/10 https://t.co/kiuXRXcg4B",Puff,https://pbs.twimg.com/media/ChqK2cVWMAAE5Zj.jpg,3032.0,757.0,3200944.0,,2016-05-07,16:34:32,11.0,Newfoundland,0.255971
728760639972315136,"When you're way too slow for the ""down low"" portion of a high five. 13/10 https://t.co/Cofwoy7Vpq",None,https://pbs.twimg.com/media/ChvAQuMWMAAVaKD.jpg,3620.0,1169.0,3200944.0,,2016-05-07,01:37:30,13.0,collie,0.266414
728751179681943552,This is Flurpson. He can't believe it's not butter. 10/10 https://t.co/XD3ort1PsE,Flurpson,https://pbs.twimg.com/media/ChvU_DwWMAArx5L.jpg,5383.0,2269.0,3200944.0,,2016-05-07,00:59:55,10.0,Saint_Bernard,0.0942456
728409960103686147,This is Wallace. He's a skater pup. He said see ya later pup. Can easily do a kick flip. Gnarly af. 10/10 v petable https://t.co/5i8fORVKgr,Wallace,https://pbs.twimg.com/media/Ch0LVPdW0AEdHgU.jpg,4722.0,1328.0,3200944.0,,2016-05-06,02:24:02,10.0,Saint_Bernard,0.48205
728387165835677696,"This is Enchilada (yes, that's her real name). She's a Low-Cruisin Plopflopple. Very rare. Only a few left. 12/10 https://t.co/SiaiTWgsfP",Enchilada,https://pbs.twimg.com/media/Ch0T71OWMAA4yIw.jpg,4953.0,1872.0,3200945.0,,2016-05-06,00:53:27,12.0,Pembroke,0.939134
728046963732717569,This is Raymond. He controls fountains with his tongue. 11/10 pretty damn magical https://t.co/9aMxSbOaAZ,Raymond,https://pbs.twimg.com/media/Ch3hOGWUYAE7w0y.jpg,4479.0,1219.0,3200945.0,,2016-05-05,02:21:37,11.0,Maltese_dog,0.95207
728015554473250816,This is Rueben. He has reached ultimate pupper zen state. 11/10 tranquil af https://t.co/Z167HgtnBi,Rueben,https://pbs.twimg.com/media/Ch-TXpFXAAAwPGf.jpg,6431.0,1962.0,3200945.0,pupper,2016-05-05,00:16:48,11.0,German_shepherd,0.829307
727685679342333952,This is Cilantro. She's a Fellation Gadzooks. Eyes are super magical af. 12/10 could get lost in https://t.co/yJ26LNuyj5,Cilantro,https://pbs.twimg.com/media/CiDap8fWEAAC4iW.jpg,4900.0,1379.0,3200945.0,,2016-05-04,02:26:00,12.0,kelpie,0.218408
727286334147182592,I swear to god if we get sent another Blue Madagascan Peacock we'll deactivate. We  Only  Rate  Dogs... 9/10 https://t.co/bbta2Q4URK,None,https://pbs.twimg.com/media/CiI7zVZUoAEzGW7.jpg,3983.0,1490.0,3200945.0,,2016-05-02,23:59:09,9.0,pug,0.341663
727175381690781696,This is Karll. He just wants to go kayaking. 10/10 please someone take Karll kayaking already https://t.co/vXLkvyNQHp,Karll,https://pbs.twimg.com/media/CiL_qh0W0AAu5VA.jpg,7496.0,2738.0,3200945.0,,2016-05-02,16:38:15,10.0,Eskimo_dog,0.682082
727155742655025152,When you're trying to enjoy yourself but end up having to take care of your way too drunk friend. 11/10 https://t.co/BRkhj6tdN0,None,https://pbs.twimg.com/media/CiOEnI6WgAAmq4E.jpg,4195.0,1677.0,3200945.0,,2016-05-02,15:20:13,11.0,American_Staffordshire_terrier,0.810158
726935089318363137,This is Sprout. He's just precious af. 12/10 I'd do anything for Sprout https://t.co/DxlX1yTVYY,Sprout,https://pbs.twimg.com/media/CiTEFjDXAAAqU6I.jpg,3882.0,1124.0,3200945.0,,2016-05-02,00:43:25,12.0,Newfoundland,0.0862411
726828223124897792,This is Bloop. He's a Phoenician Winnebago. Tongue is just wow. That box is all he has (tragic). 12/10 would caress https://t.co/DWNrPPXgHA,Bloop,https://pbs.twimg.com/media/CiYME3tVAAENz99.jpg,7691.0,2970.0,3200945.0,,2016-05-01,17:38:46,12.0,Pembroke,0.967103
725842289046749185,This is Colby. He's currently regretting all those times he shook your hand for an extra treat. 12/10 https://t.co/vtVHtKFtBH,Colby,https://pbs.twimg.com/media/CinrX2EWkAABDYt.jpg,5646.0,2009.0,3200945.0,,2016-04-29,00:21:01,12.0,basset,0.000547053
725786712245440512,Say hello to Lillie. She's a Rutabagan Floofem. Poor pupper ate and then passed out. 11/10 relatable af https://t.co/uIdGqug9rw,Lillie,https://pbs.twimg.com/media/Ciqq-VFUUAANlWm.jpg,1541.0,703.0,3200945.0,pupper,2016-04-28,20:40:11,11.0,Staffordshire_bullterrier,0.843359
725729321944506368,This is Lola. She's a Butternut Splishnsplash. They are known to be ferocious af. 12/10 would absolutely still pet https://t.co/adQt5a6TZU,Lola,https://pbs.twimg.com/media/CisqdVcXEAE3iW7.jpg,4040.0,1462.0,3200945.0,,2016-04-28,16:52:08,12.0,Pomeranian,0.961902
725458796924002305,"Pup had to be removed cuz it wouldn't have been fair to the opposing team. 13/10 absolute legend 
https://t.co/BHICimO58W",None,https://pbs.twimg.com/media/CiswCQhWYAI5-QW.jpg,2593.0,725.0,3200945.0,,2016-04-27,22:57:10,13.0,Staffordshire_bullterrier,0.127969
724771698126512129,Nothin better than a doggo and a sunset. 11/10 https://t.co/JlFqOhrHEs,None,https://pbs.twimg.com/media/Ci3GDeyUoAAKOxn.jpg,4738.0,1984.0,3200945.0,doggo,2016-04-26,01:26:53,11.0,chow,0.931275
724405726123311104,This is Ashleigh. She's having Coachella withdrawals. Didn't even go tho. 10/10 stay strong pupper https://t.co/nRUaKWnJfH,Ashleigh,https://pbs.twimg.com/media/Ci3Z_idUkAA8RUh.jpg,2901.0,620.0,3200945.0,pupper,2016-04-25,01:12:38,10.0,French_bulldog,0.619382
724049859469295616,This is Kreggory. He just took a look at his student debt. 10/10 can't even comprehend it https://t.co/XTsZTgilnT,Kreggory,https://pbs.twimg.com/media/Ci8Pfg_UUAA2m9i.jpg,4561.0,1790.0,3200945.0,,2016-04-24,01:38:33,10.0,Lhasa,0.457356
724046343203856385,"This is Sarge. Not even he knows what his tongue is doing, but it's pretty damn spectacular. 10/10 https://t.co/pIQEdbBxdL",Sarge,https://pbs.twimg.com/media/Ci8UxxcW0AYgHDh.jpg,4236.0,1374.0,3200945.0,,2016-04-24,01:24:35,10.0,beagle,0.472324
724004602748780546,This is Luther. He saw a ghost. Spooked af. 11/10 hang in there pupper https://t.co/EdKG43VvEl,Luther,https://pbs.twimg.com/media/CjJzMlBUoAADMLx.jpg,8435.0,3347.0,3200945.0,pupper,2016-04-23,22:38:43,11.0,Siberian_husky,0.304902
723912936180330496,This is Sugar. She's a Bolivian Superfloof. Spherical af. 12/10 would never let go of https://t.co/AhMfUu6Onm,Sugar,https://pbs.twimg.com/media/CjJ9gQ1WgAAXQtJ.jpg,3291.0,1011.0,3200945.0,,2016-04-23,16:34:28,12.0,golden_retriever,0.883991
723688335806480385,This is Reginald. He starts screaming at random. 12/10 cuddly af https://t.co/YgNuDQbv89,Reginald,https://pbs.twimg.com/media/CjLuzPvUoAAbU5k.jpg,5761.0,2110.0,3200945.0,,2016-04-23,01:41:59,12.0,Maltese_dog,0.847292
723673163800948736,This is Ivar. She is a badass Viking warrior. Will sack your village. 10/10 savage af https://t.co/Dz6MiVssVU,Ivar,https://pbs.twimg.com/media/CjO7OfeWgAAUQy-.jpg,4493.0,1764.0,3200945.0,,2016-04-23,00:41:42,10.0,Walker_hound,0.413535
723179728551723008,This is Jangle. She's addicted to broccoli. It's the only thing she cares about. Tragic af. 8/10 get help pup https://t.co/8dNWp1cSEa,Jangle,https://pbs.twimg.com/media/CjQnclkVEAA4pnK.jpg,5393.0,1831.0,3200945.0,,2016-04-21,16:00:57,8.0,Staffordshire_bullterrier,0.523191
722613351520608256,Meet Schnitzel. He's a Tropicana Floofboop. Getting too big for his favorite basket. 12/10 just so damn fluffy https://t.co/qjd0UJKYUY,Schnitzel,https://pbs.twimg.com/media/CjWANBlVAAAaN-a.jpg,2748.0,686.0,3200945.0,,2016-04-20,02:30:23,12.0,pug,0.8918709999999999
721503162398597120,This is Panda. He's happy af. 11/10 https://t.co/IOAk9i4UvE,Panda,https://pbs.twimg.com/media/CjWMezdW0AErwU3.jpg,3400.0,866.0,3200945.0,,2016-04-17,00:58:53,11.0,Pembroke,0.462594
721001180231503872,This is Oliver. Bath time is upon him. His fear of the wetness postpones his ultimate pupper destiny. 11/10 https://t.co/AFzzKqR4tT,Oliver,https://pbs.twimg.com/media/CjbExRKUoAAs089.jpg,2702.0,760.0,3200945.0,pupper,2016-04-15,15:44:11,11.0,cocker_spaniel,0.961643
720785406564900865,This is Archie. He hears everything you say. Doesn't matter where you are. 12/10 https://t.co/0l4I8famYp,Archie,https://pbs.twimg.com/media/CjbV-lEWgAAr6WY.jpg,4503.0,1681.0,3200945.0,,2016-04-15,01:26:47,12.0,golden_retriever,0.553901
720775346191278080,This is Berkeley. He's in a predicament. 10/10 someone help him https://t.co/XSEXdQupej,Berkeley,https://pbs.twimg.com/media/CjeY5DKXEAA3WkD.jpg,6974.0,2840.0,3200945.0,,2016-04-15,00:46:48,10.0,Labrador_retriever,0.399217
720415127506415616,Garden's coming in nice this year. 10/10 https://t.co/5Lra3e4rrw,None,https://pbs.twimg.com/media/CjgYyuvWkAAHU8g.jpg,3131.0,1098.0,3200945.0,,2016-04-14,00:55:25,10.0,toy_poodle,0.082606
720389942216527872,This is Ralph. He patrols the lake. Looking for babes. 11/10 https://t.co/Pb6iMmo0wk,Ralph,https://pbs.twimg.com/media/CjlpmZaUgAED54W.jpg,4229.0,1268.0,3200945.0,,2016-04-13,23:15:21,11.0,schipperke,0.545502
720043174954147842,This is Neptune. He's a Snowy Swiss Mountain Floofapolis. Cheeky wink. Tongue nifty af. 11/10 would pet so firmly https://t.co/SoZq2Xoopv,Neptune,https://pbs.twimg.com/media/CjvvHBwUoAE55WZ.jpg,4974.0,1645.0,3200945.0,,2016-04-13,00:17:25,11.0,Samoyed,0.400568
719991154352222208,This doggo was initially thrilled when she saw the happy cartoon pup but quickly realized she'd been deceived. 10/10 https://t.co/mvnBGaWULV,None,https://pbs.twimg.com/media/CjzC2oGWYAAyIfG.jpg,5515.0,2192.0,3200945.0,doggo,2016-04-12,20:50:42,10.0,Pembroke,0.935307
719704490224398336,This is Clyde. He's making sure you're having a good train ride. 12/10 great pupper https://t.co/y206kWHAj0,Clyde,https://pbs.twimg.com/media/Cj0xdMBVAAEbDHp.jpg,3022.0,827.0,3200945.0,pupper,2016-04-12,01:51:36,12.0,malamute,0.374682
719551379208073216,This is Harnold. He accidentally opened the front facing camera. 10/10 get it together Harnold https://t.co/S6JHaSMtln,Harnold,https://pbs.twimg.com/media/Cj1I1fbWYAAOwff.jpg,4822.0,1403.0,3200944.0,,2016-04-11,15:43:12,10.0,vizsla,0.990391
719367763014393856,Meet Sid &amp; Murphy. Murphy floats alongside Sid and whispers motivational quotes in his ear. Magical af. Both 11/10 https://t.co/7mmjyearQW,Sid,https://pbs.twimg.com/media/Cj51Oj3VAAEVe4O.jpg,3711.0,1078.0,3200944.0,,2016-04-11,03:33:34,11.0,pug,0.751758
719339463458033665,Say hello to Lucy and Sophie. They think they're the same size. Both 10/10 would snug at same time https://t.co/HW50zkcf2R,Lucy,https://pbs.twimg.com/media/Cj5-aUQUgAAb43p.jpg,3818.0,1231.0,3200944.0,,2016-04-11,01:41:07,10.0,keeshond,0.8788860000000001
719332531645071360,This is Pippa. She managed to start the car but is waiting for you to buckle up before driving. Responsible af 11/10 https://t.co/htrlmC7saz,Pippa,https://pbs.twimg.com/media/Cj6O1G9UYAAIU-1.jpg,5720.0,1973.0,3200944.0,,2016-04-11,01:13:34,11.0,Bedlington_terrier,0.289471
718971898235854848,This is Sadie. She is prepared for battle. 10/10 https://t.co/JRckDkZVRT,Sadie,https://pbs.twimg.com/media/Cj9VEs_XAAAlTai.jpg,20697.0,9126.0,3200944.0,,2016-04-10,01:20:33,10.0,cocker_spaniel,0.346695
718939241951195136,This is Otis. Everybody look at Otis. 12/10 would probably faint while petting https://t.co/I9qoe1uEih,Otis,https://pbs.twimg.com/media/Cj_P7rSUgAAYQbz.jpg,2669.0,542.0,3200944.0,,2016-04-09,23:10:47,12.0,chow,0.808737
718631497683582976,We normally don't rate marshmallows but this one appears to be flawlessly toasted so I'll make an exception. 10/10 https://t.co/D9jbbmPmos,None,https://pbs.twimg.com/media/CkEKe3QWYAAwoDy.jpg,2730.0,1137.0,3200944.0,,2016-04-09,02:47:55,10.0,Labrador_retriever,0.691137
718613305783398402,This is Carper. He's a Tortellini Angiosperm. In desperate need of a petting. 11/10 would hug softly https://t.co/lK9YDkRzPj,Carper,https://pbs.twimg.com/media/CkEMBz9WYAAGLaa.jpg,2846.0,602.0,3200944.0,,2016-04-09,01:35:37,11.0,American_Staffordshire_terrier,0.0155351
718540630683709445,Get you a pup that can do both. 10/10 https://t.co/zSbyvm62xZ,None,https://pbs.twimg.com/ext_tw_video_thumb/739238016737267712/pu/img/-tLpyiuIzD5zR1et.jpg,5320.0,1685.0,3200944.0,,2016-04-08,20:46:50,10.0,Eskimo_dog,0.503372
718460005985447936,Meet Bowie. He's listening for underground squirrels. Smart af. Left eye is considerably magical. 9/10 would so pet https://t.co/JyNmyjy3fe,Bowie,https://pbs.twimg.com/media/CkMuP7SWkAAD-2R.jpg,2115.0,565.0,3200944.0,,2016-04-08,15:26:28,9.0,Walker_hound,0.640256
718246886998687744,This is Alexanderson. He's got a weird ass birth mark. Dreadful at fetch. Won't eat kibble. 3/10 wtf @Target https://t.co/FmxOpf2Sgl,Alexanderson,https://pbs.twimg.com/media/CkOb3FXW0AAUL_U.jpg,2660.0,670.0,3200944.0,,2016-04-08,01:19:36,3.0,Blenheim_spaniel,0.933755
718234618122661888,This is Suki. She was born with a blurry tail (unfortunate). Next level tongue tho. 11/10 nifty hardwood https://t.co/05S8oYztgb,Suki,https://pbs.twimg.com/media/CkR0jrhWYAALL5N.jpg,3170.0,1272.0,3200944.0,,2016-04-08,00:30:51,11.0,toy_poodle,0.342397
717841801130979328,This is Barclay. His father was a banana. 11/10 appeeling af https://t.co/ucOEfr2rjV,Barclay,https://pbs.twimg.com/media/CkTFEe-W0AA90m1.jpg,6281.0,2069.0,3200944.0,,2016-04-06,22:29:56,11.0,redbone,0.243904
717790033953034240,"Here's a badass mystery pupper. You weren't aware that you owe him money, but you do. 10/10 shades sick af https://t.co/fv9e9AtzSG",None,https://pbs.twimg.com/media/CkTvJTdXAAAEfbT.jpg,1748.0,510.0,3200945.0,pupper,2016-04-06,19:04:14,10.0,Irish_water_spaniel,0.2858
717537687239008257,People please. This is a Deadly Mediterranean Plop T-Rex. We only rate dogs. Only send in dogs. Thanks you... 11/10 https://t.co/2ATDsgHD4n,None,https://pbs.twimg.com/media/CkXEu2OUoAAs8yU.jpg,3446.0,945.0,3200945.0,,2016-04-06,02:21:30,11.0,Chesapeake_Bay_retriever,0.586414
717428917016076293,This is Skittle. He's trying to communicate. 11/10 solid effort https://t.co/6WTfJvtKx6,Skittle,https://pbs.twimg.com/media/CkZImGVUoAAwv0b.jpg,6826.0,2135.0,3200945.0,,2016-04-05,19:09:17,11.0,golden_retriever,0.8636870000000001
717047459982213120,This is Flvio (pronounced Baxter). He's a Benesnoop Cumberdog. Super rare. Symmetrical. 12/10 would pet so well https://t.co/fGgleFiBPq,Flvio,https://pbs.twimg.com/media/CkZVdJ6WYAAXZ5A.jpg,4627.0,1317.0,3200945.0,,2016-04-04,17:53:31,12.0,golden_retriever,0.8076439999999999
717009362452090881,This is Smokey. He's having some sort of existential crisis. 10/10 hang in there pupper https://t.co/JmgF4dMpw0,Smokey,https://pbs.twimg.com/media/Ckdpx5KWsAANF6b.jpg,5204.0,1474.0,3200945.0,pupper,2016-04-04,15:22:08,10.0,Norwegian_elkhound,0.275225
716791146589110272,Meet Jennifur. She's supposed to be navigating. Not even buckled up. Insubordinate &amp; churlish. 11/10 would still pet https://t.co/h0trcJohYO,Jennifur,https://pbs.twimg.com/media/CkeJcNkXEAAcrks.jpg,14327.0,6643.0,3200945.0,,2016-04-04,00:55:01,11.0,toy_poodle,0.388277
716730379797970944,"There has clearly been a mistake. Pup did nothing wrong. 12/10 would help escape
https://t.co/Juid3nnLbC",None,https://pbs.twimg.com/media/CkiLHCjUUAAPwUr.jpg,2574.0,247.0,3200945.0,,2016-04-03,20:53:33,12.0,malamute,0.454363
716439118184652801,This is Bluebert. He just saw that both #FinalFur match ups are split 50/50. Amazed af. 11/10 https://t.co/Kky1DPG4iq,Bluebert,https://pbs.twimg.com/media/Ckmj7mNWYAA4NzZ.jpg,5272.0,1935.0,3200945.0,,2016-04-03,01:36:11,10.0,Chihuahua,0.7681560000000001
716285507865542656,This is Stephanus. She stays woke. 12/10 https://t.co/WIWabMngQZ,Stephanus,https://pbs.twimg.com/media/CkoeKTPWYAAcWmo.jpg,3485.0,987.0,3200945.0,,2016-04-02,15:25:47,12.0,Chesapeake_Bay_retriever,0.292675
716080869887381504,Here's a super majestic doggo and a sunset 11/10 https://t.co/UACnoyi8zu,None,https://pbs.twimg.com/media/Cksz42EW0AAh2NF.jpg,4085.0,1596.0,3200945.0,doggo,2016-04-02,01:52:38,11.0,Labrador_retriever,0.786089
715928423106027520,This is Bubbles. He's a Yorkshire Piccolope. 11/10 would snug aggressively https://t.co/3BhMojONxq,Bubbles,https://pbs.twimg.com/media/CkthBj7WgAAsIGb.jpg,5093.0,1920.0,3200945.0,,2016-04-01,15:46:52,11.0,kuvasz,0.311325
715758151270801409,This is old now but it's absolutely heckin fantastic and I can't not share it with you all. 13/10  https://t.co/wJX74TSgzP,None,https://pbs.twimg.com/media/CkylrVWWsAAiXJE.jpg,3055.0,634.0,3200945.0,,2016-04-01,04:30:16,13.0,French_bulldog,0.07141439999999999
715704790270025728,This is Bentley. He gives kisses back. 11/10 precious af (vid by @emmaallen25) https://t.co/9PnKkKzoUp,Bentley,https://pbs.twimg.com/media/Ck18CFcXIAAUWoy.jpg,4719.0,1813.0,3200945.0,,2016-04-01,00:58:13,11.0,Cardigan,0.5669109999999999
715342466308784130,This is Oscar. He's a world renowned snowball inspector. It's a ruff job but someone has to do it. 10/10 great guy https://t.co/vSufMAKm3C,Oscar,https://pbs.twimg.com/media/ClBqDuDWkAALK2e.jpg,5578.0,2110.0,3200947.0,,2016-03-31,00:58:29,10.0,golden_retriever,0.930705
715220193576927233,This is Nico. His selfie game is strong af. Excellent use of a sneaky tongue slip. 10/10 star material https://t.co/1OBdJkMOFx,Nico,https://pbs.twimg.com/media/ClB09z0WYAAA1jz.jpg,4550.0,1392.0,3200947.0,,2016-03-30,16:52:36,10.0,kuvasz,0.350629
715200624753819648,This is Michelangelope. He's half coffee cup. Rare af. 12/10 would hug until someone stopped me https://t.co/tvVDY0G911,Michelangelope,https://pbs.twimg.com/media/ClCQzFUUYAA5vAu.jpg,4094.0,1166.0,3200947.0,,2016-03-30,15:34:51,12.0,malamute,0.442612
714982300363173890,This is Calbert. He forgot to clear his Google search history. 9/10 rookie mistake Calbert https://t.co/jRm5J3YCmj,Calbert,https://pbs.twimg.com/media/ClGawiUWAAAgs0w.jpg,4503.0,1595.0,3200947.0,,2016-03-30,01:07:18,9.0,standard_poodle,0.06058350000000001
714957620017307648,This is Curtis. He's an Albino Haberdasher. Terrified of dandelions. They really spook him up. 10/10 it'll be ok pup https://t.co/s8YcfZrWhK,Curtis,https://pbs.twimg.com/media/ClHUkhQWAAAy7Yj.jpg,3938.0,1038.0,3200947.0,,2016-03-29,23:29:14,10.0,Weimaraner,0.982794
714631576617938945,This is Benedict. He's a feisty pup. Needs a brushing. Portable af. Looks very angry actually. 4/10 might not pet https://t.co/3oeFfHjv0Z,Benedict,https://pbs.twimg.com/media/ClLZU8LWQAAsOxV.jpg,2962.0,1313.0,3200947.0,,2016-03-29,01:53:39,4.0,dalmatian,0.562315
714606013974974464,Here are two lil cuddly puppers. Both 12/10 would snug like so much https://t.co/zO4eb7C4tG,None,https://pbs.twimg.com/media/ClMl4VLUYAA5qBb.jpg,3281.0,808.0,3200947.0,pupper,2016-03-29,00:12:05,12.0,bull_mastiff,0.97573
714485234495041536,This is Blitz. He screams. 10/10 (vid by @yeaahliv) https://t.co/MfW2aym5UF,Blitz,https://pbs.twimg.com/ext_tw_video_thumb/744234667679821824/pu/img/1GaWmtJtdqzZV7jy.jpg,3570.0,940.0,3200947.0,,2016-03-28,16:12:09,10.0,Labrador_retriever,0.825333
714258258790387713,"Meet Travis and Flurp. Travis is pretty chill but Flurp can't lie down properly. 10/10 &amp; 8/10
get it together Flurp https://t.co/Akzl5ynMmE",Travis,https://pbs.twimg.com/media/ClRoXGwWIAEVVzc.jpg,2480.0,990.0,3200947.0,,2016-03-28,01:10:13,10.0,Samoyed,0.960543
714251586676113411,This is Thumas. He hates potted plants. 8/10 wtf Thumas https://t.co/rDVueNIcEi,Thumas,https://pbs.twimg.com/media/ClW9w7mWEAEFN1k.jpg,4673.0,1569.0,3200947.0,,2016-03-28,00:43:43,8.0,Shetland_sheepdog,0.234431
714214115368108032,Happy Easter from the squad!  13/10 for all https://t.co/YMx4KWJUAB,None,https://pbs.twimg.com/media/ClarNU8VAAEDrDt.jpg,3564.0,869.0,3200947.0,,2016-03-27,22:14:49,13.0,toy_poodle,0.497755
714141408463036416,"I know we only rate dogs, but since it's Easter I guess we could rate a bunny for a change. 10/10 petable as hell https://t.co/O2RlKXigHu",None,https://pbs.twimg.com/media/ClbBg4WWEAMjwJu.jpg,2078.0,616.0,3200947.0,,2016-03-27,17:25:54,10.0,Old_English_sheepdog,0.4274810000000001
713919462244790272,This is Kanu. He's a Freckled Ticonderoga. Simply flawless. 12/10 would perform an elaborate heist to capture https://t.co/7vyAzIURrE,Kanu,https://pbs.twimg.com/media/Clb5pLJWMAE-QS1.jpg,3062.0,829.0,3200947.0,,2016-03-27,02:43:58,12.0,Shetland_sheepdog,0.963985
713900603437621249,Happy Saturday here's 9 puppers on a bench. 99/90 good work everybody https://t.co/mpvaVxKmc1,None,https://pbs.twimg.com/media/ClhGBCAWIAAFCsz.jpg,4802.0,1440.0,3200947.0,pupper,2016-03-27,01:29:02,11.0,Labrador_retriever,0.6638
713761197720473600,This is Piper. She would really like that tennis ball core. Super sneaky tongue slip. 12/10 precious af https://t.co/QP6GHi5az9,Piper,https://pbs.twimg.com/media/ClhQJUUWAAEVpBX.jpg,7854.0,3183.0,3200947.0,,2016-03-26,16:15:05,12.0,basset,1.44895e-05
713411074226274305,Here we see an extremely rare Bearded Floofmallow. Only a few left in the wild. 11/10 would pet with a purpose https://t.co/jVJJKlPbvq,None,https://pbs.twimg.com/media/CllNnkWWMAEDIAR.jpg,4851.0,1630.0,3200947.0,,2016-03-25,17:03:49,11.0,chow,0.06275449999999999
713177543487135744,This is Lance. Lance doesn't give a shit. 10/10 we should all be more like Lance https://t.co/SqnG9Ap28J,Lance,https://pbs.twimg.com/media/ClmT0KHWkAAXbhy.jpg,20378.0,7602.0,3200947.0,,2016-03-25,01:35:51,10.0,Pekinese,0.984267
713175907180089344,Say hello to Opie and Clarkus. Clarkus fell asleep so Opie buried him. Ruthless af 10/10 for both https://t.co/xT7XaY4gnW,Opie,https://pbs.twimg.com/media/ClqGl7fXIAA8nDe.jpg,13474.0,5616.0,3200947.0,,2016-03-25,01:29:21,10.0,Shetland_sheepdog,0.43332
712809025985978368,This is Stubert. He just arrived. 10/10 https://t.co/HVGs5aAKAn,Stubert,https://pbs.twimg.com/media/ClrK-rGWAAENcAa.jpg,4531.0,1367.0,3200947.0,,2016-03-24,01:11:29,10.0,chow,0.575637
712717840512598017,Please don't send in any more polar bears. We only rate dogs. Thank you... 10/10 https://t.co/83RGhdIQz2,None,https://pbs.twimg.com/media/ClujESVXEAA4uH8.jpg,5799.0,1756.0,3200947.0,,2016-03-23,19:09:09,10.0,German_shepherd,0.622957
712668654853337088,Say hello to Sunny and Roxy. They pull things out of water together. 10/10 for both https://t.co/88aedAmxcl,Sunny,https://pbs.twimg.com/media/Clwgf4bWgAAB15c.jpg,269.0,26.0,3200947.0,,2016-03-23,15:53:42,10.0,toy_poodle,0.508292
712438159032893441,This is Kane. He's a semi-submerged Haitian Huffleplop. Happy af. Sick waterfall. 11/10 would pat head approvingly https://t.co/7zjEC501Ul,Kane,https://pbs.twimg.com/media/ClzoJz7WYAELHSf.jpg,4144.0,1172.0,3200947.0,,2016-03-23,00:37:48,11.0,golden_retriever,0.25650500000000004
712309440758808576,"Reminder that we made our first set of stickers available! All are 12/10 would stick
Use code ""pupper"" at checkout

https://t.co/kJIMNyMNKV",None,https://pbs.twimg.com/media/Cl0iFdeXEAQtPyT.jpg,3211.0,1016.0,3200947.0,pupper,2016-03-22,16:06:19,12.0,Boston_bull,0.936183
712097430750289920,I can't even comprehend how confused this dog must be right now. 10/10 https://t.co/8AGcQ4hIfK,None,https://pbs.twimg.com/media/Cl071YVWEAAlF7N.jpg,3531.0,556.0,3200947.0,,2016-03-22,02:03:52,10.0,Ibizan_hound,0.101537
