tweet_id,text,name,jpg_url,favorite_count,retweet_count,user_count,dog_stage,date,time,rating,dog_breed,conf_lvl
686050296934563840,This is Flvio. He's a Macedonian Poppycock. 97% floof. Jubilant af. 11/10 personally I'd pet the hell out of https://t.co/BUyX7isHRg,Flvio,https://pbs.twimg.com/media/CxbX_n2WIAAHaLS.jpg,3424.0,1324.0,3200950.0,,2016-01-10,05:01:51,11.0,Norfolk_terrier,0.334436
686035780142297088,"Yes I do realize a rating of 4/20 would've been fitting. However, it would be unjust to give these cooperative pups that low of a rating",None,https://pbs.twimg.com/media/CxeseRgUoAM_SQK.jpg,2704.0,472.0,3200950.0,,2016-01-10,04:04:10,2.0,malamute,0.985028
686034024800862208,Your fav crew is back and this time they're embracing cannabis culture. 12/10 for all https://t.co/oSvRDuMm1D,None,https://pbs.twimg.com/media/Cxge6AdUQAAvXLB.jpg,2009.0,735.0,3200950.0,,2016-01-10,03:57:12,12.0,miniature_pinscher,0.58363
686007916130873345,This pupper has a magical eye. 11/10 I can't stop looking at it https://t.co/heAGpKTpPW,None,https://pbs.twimg.com/media/CxlPnoSUcAEXf1i.jpg,2326.0,611.0,3200950.0,pupper,2016-01-10,02:13:27,11.0,Border_collie,0.442534
686003207160610816,This is Hammond. He's a peculiar pup. Loves long walks. Bark barely audible. Too many legs. 3/10 must be rare https://t.co/NOIiRWr5Jf,Hammond,https://pbs.twimg.com/media/CsGnz64WYAEIDHJ.jpg,1801.0,696.0,3200950.0,,2016-01-10,01:54:44,3.0,chow,0.316565
685906723014619143,This is Olive. He's stuck in a sleeve. 9/10 damn it Olive https://t.co/NnLjg6BgyF,Olive,https://pbs.twimg.com/media/CxuM3oZW8AEhO5z.jpg,2579.0,666.0,3200950.0,,2016-01-09,19:31:20,9.0,golden_retriever,0.35986
685663452032069632,"Meet Brooks. He's confused by the almighty ball of tennis. 12/10 

(vid by @PDolan37) https://t.co/AcVWe39nmM",Brooks,https://pbs.twimg.com/media/Cxv-nkJUoAAhzMt.jpg,35052.0,17465.0,3200950.0,,2016-01-09,03:24:40,12.0,Pembroke,0.8289040000000001
685641971164143616,This is Otis. He just passed a cop while going 61 in a 45. Very nervous pupper. 7/10 https://t.co/jJS8qQeuNO,Otis,https://pbs.twimg.com/media/CxzXOyBW8AEu_Oi.jpg,3336.0,1298.0,3200950.0,pupper,2016-01-09,01:59:19,7.0,cocker_spaniel,0.771984
685547936038666240,Everybody needs to read this. Jack is our first 14/10. Truly heroic pupper https://t.co/3m6bNGXWnM,None,https://pbs.twimg.com/media/Cx4h7zHUsAAqaJd.jpg,10471.0,4535.0,3200950.0,pupper,2016-01-08,19:45:39,14.0,dalmatian,0.823356
685321586178670592,This is Rocky. He sleeps like a psychopath. 10/10 quality tongue slip https://t.co/MbgG95mUdu,Rocky,https://pbs.twimg.com/media/Cx-itFWWIAAZu7l.jpg,2262.0,496.0,3200950.0,,2016-01-08,04:46:13,10.0,Pembroke,0.550506
685315239903100929,I would like everyone to appreciate this pup's face as much as I do. 11/10 https://t.co/QIe7oxkSNo,None,https://pbs.twimg.com/media/CyEg2AXUsAA1Qpf.jpg,3419.0,1371.0,3200950.0,,2016-01-08,04:21:00,11.0,Staffordshire_bullterrier,0.327887
685307451701334016,Say hello to Petrick. He's an Altostratus Floofer. Just had a run in with a trash bag. Groovy checkered floor. 11/10 https://t.co/rwW7z1JAOF,Petrick,https://pbs.twimg.com/media/CyIgaTEVEAA-9zS.jpg,2566.0,764.0,3200950.0,,2016-01-08,03:50:03,11.0,Eskimo_dog,0.482498
685268753634967552,This is Hubertson. He's a Carmel Haberdashery. Enjoys long summer days on his boat. Very peaceful pupper. 10/10 https://t.co/vzCl35fKlZ,Hubertson,https://pbs.twimg.com/media/Cs_DYr1XEAA54Pu.jpg,4489.0,1620.0,3200950.0,pupper,2016-01-08,01:16:17,10.0,Chihuahua,0.721188
685198997565345792,This is Alfie. That is his time machine. He's very proud of it. Without him life as we know it would not exist 11/10 https://t.co/530Yfbl5xo,Alfie,https://pbs.twimg.com/media/CyI3zXgWEAACQfB.jpg,2374.0,421.0,3200950.0,,2016-01-07,20:39:06,11.0,Labrador_retriever,0.8971620000000001
684969860808454144,"For those who claim this is a goat, u are wrong. It is not the Greatest Of All Time. The rating of 5/10 should have made that clear. Thank u",None,https://pbs.twimg.com/media/CyNPmJgXcAECPuB.jpg,3523.0,1191.0,3200950.0,,2016-01-07,05:28:35,5.0,golden_retriever,0.610171
684959798585110529,This is Jerry. He's a neat dog. No legs (tragic). Has more horns than a dog usually does. Bark is unique af. 5/10 https://t.co/85q7xlplsJ,Jerry,https://pbs.twimg.com/media/CsrjryzWgAAZY00.jpg,3849.0,552.0,3200950.0,,2016-01-07,04:48:36,5.0,cocker_spaniel,0.253442
684940049151070208,This is Oreo. She's a photographer and a model. Living a double pupple life. 12/10 such talent much cute would pet https://t.co/zNeLxJeAoL,Oreo,https://pbs.twimg.com/media/CySpCSHXcAAN-qC.jpg,3848.0,1662.0,3200950.0,,2016-01-07,03:30:07,12.0,chow,0.944032
684926975086034944,Meet Bruiser &amp; Charlie. They are the best of pals. Been through it all together. Both 11/10. 1 like=1 friendship https://t.co/PEXHuvSVD4,Bruiser,https://pbs.twimg.com/media/CyXPzXRWgAAvd1j.jpg,2053.0,605.0,3200950.0,,2016-01-07,02:38:10,11.0,Pembroke,0.457086
684902183876321280,This is Perry. He's an Augustus Gloopster. Very condescending. Makes up for it with the sneaky tongue slip. 11/10 https://t.co/JVvIrUmTkR,Perry,https://pbs.twimg.com/ext_tw_video_thumb/803638023904559104/pu/img/vxm0Htm5iIV7EOAQ.jpg,38551.0,24514.0,3200950.0,,2016-01-07,00:59:40,11.0,Labrador_retriever,0.372776
684880619965411328,Here we have a basking dino pupper. Looks powerful. Occasionally shits eggs. Doesn't want the holidays to end. 5/10 https://t.co/DnNweb5eTO,None,https://pbs.twimg.com/media/CZhn-QAWwAASQan.jpg,2979.0,1124.0,3200950.0,pupper,2016-01-06,23:33:58,5.0,Lakeland_terrier,0.530104
684830982659280897,This little fella really hates stairs. Prefers bush. 13/10 legendary pupper https://t.co/e3LPMAHj7p,None,https://pbs.twimg.com/media/CyeTku-XcAALkBd.jpg,9843.0,4016.0,3200950.0,pupper,2016-01-06,20:16:44,13.0,miniature_pinscher,0.817066
684594889858887680,"""FOR THE LAST TIME I DON'T WANNA PLAY TWISTER ALL THE SPOTS ARE GREY DAMN IT CINDY"" ...10/10 https://t.co/uhQNehTpIu",None,https://pbs.twimg.com/media/CuRDF-XWcAIZSer.jpg,3312.0,1418.0,3200950.0,,2016-01-06,04:38:35,10.0,chow,0.0903414
684588130326986752,This pupper just got his first kiss. 12/10 he's so happy https://t.co/2sHwD7HztL,None,https://pbs.twimg.com/media/CysBn-lWIAAoRx1.jpg,2915.0,1085.0,3200950.0,pupper,2016-01-06,04:11:43,12.0,Tibetan_mastiff,0.91579
684567543613382656,This is Bobby. He doesn't give a damn about personal space. Convinced he called shotgun first. 4/10 not the best dog https://t.co/b8XW69gSaU,Bobby,https://pbs.twimg.com/media/CyysDQlVIAAYgrl.jpg,4249.0,1320.0,3200951.0,,2016-01-06,02:49:55,4.0,Pembroke,0.244705
684481074559381504,Meet Pippa. She's an Elfin High Feta. Compact af. Easy to transport. Great for vacations. 10/10 would keep in pocket https://t.co/nBtDeZ4yAb,Pippa,https://pbs.twimg.com/media/Cy3IvdZXgAUoEaj.jpg,8999.0,3727.0,3200952.0,,2016-01-05,21:06:19,10.0,malinois,0.643147
684460069371654144,This is Jeph. He's a Western Sagittarius Dookmarriot. Frightened by leaf. Caught him off guard. 10/10 calm down Jeph https://t.co/bicyOV6lju,Jeph,https://pbs.twimg.com/ext_tw_video_thumb/805826823359631360/pu/img/yr_fF0TZCR-B70p2.jpg,1369.0,239.0,3200952.0,,2016-01-05,19:42:51,10.0,Siberian_husky,0.248926
684241637099323392,This is Obi. He got camera shy. 12/10 https://t.co/feiPiq7z94,Obi,https://pbs.twimg.com/media/Cy8_qt0UUAAHuuN.jpg,4225.0,1563.0,3200952.0,,2016-01-05,05:14:53,12.0,Norwegian_elkhound,0.657967
684225744407494656,"Two sneaky puppers were not initially seen, moving the rating to 143/130. Please forgive us. Thank you https://t.co/kRK51Y5ac3",None,https://pbs.twimg.com/media/CtzKC7zXEAALfSo.jpg,2394.0,1177.0,3200860.0,pupper,2016-01-05,04:11:44,11.0,Irish_setter,0.574557
684222868335505415,Someone help the girl is being mugged. Several are distracting her while two steal her shoes. Clever puppers 121/110 https://t.co/1zfnTJLt55,None,https://pbs.twimg.com/media/CzBD7MWVIAA5ptx.jpg,2108.0,595.0,3200952.0,pupper,2016-01-05,04:00:18,11.0,chow,0.835102
684200372118904832,Gang of fearless hoofed puppers here. Straight savages. Elevated for extra terror. Front one has killed before 6/10s https://t.co/jkCb25OWfh,None,https://pbs.twimg.com/media/Ct72q9jWcAAhlnw.jpg,3831.0,1343.0,3200952.0,pupper,2016-01-05,02:30:55,6.0,Cardigan,0.593858
684195085588783105,This is Tino. He really likes corndogs. 9/10 https://t.co/cUxGtnBfc2,Tino,https://pbs.twimg.com/media/CzFp3FNW8AAfvV8.jpg,2215.0,764.0,3200952.0,,2016-01-05,02:09:54,9.0,vizsla,0.938617
684177701129875456,This is Kulet. She's very proud of the flower she picked. Loves it dearly. 10/10 now I want a flower https://t.co/myUUwqJIs7,Kulet,https://pbs.twimg.com/media/CzMTcZoXUAEKqEt.jpg,2176.0,539.0,3200952.0,,2016-01-05,01:00:50,10.0,golden_retriever,0.610807
684147889187209216,This is Sweets the English Bulldog. Waves back to other bikers. 12/10 just a fantastic friendly pupper https://t.co/WYiFzuX7D4,Sweets,https://pbs.twimg.com/media/Ct2qO5PXEAE6eB0.jpg,4515.0,1621.0,3200952.0,pupper,2016-01-04,23:02:22,12.0,golden_retriever,0.17139300000000002
684097758874210310,Say hello to Lupe. This is how she sleeps. 10/10 impressive really https://t.co/Fz6iZWlk8C,Lupe,https://pbs.twimg.com/media/CzU_YVGUUAA3Xsd.jpg,2111.0,397.0,3200952.0,,2016-01-04,19:43:10,10.0,golden_retriever,0.873233
683857920510050305,Meet Sadie. She fell asleep on the beach and her friends buried her. 10/10 can't trust fellow puppers these days https://t.co/LoKVvc1xAW,Sadie,https://pbs.twimg.com/media/CzaY5UdUoAAC91S.jpg,2896.0,1116.0,3200860.0,pupper,2016-01-04,03:50:08,10.0,Labrador_retriever,0.730959
683852578183077888,"Say hello to Tiger. He's a penbroke (little dog pun for ya, no need to applaud I know it was good) 10/10 good dog https://t.co/Yei0HzS3JN",Tiger,https://pbs.twimg.com/media/Czb4iFRXgAIUMiN.jpg,2880.0,1265.0,3200952.0,,2016-01-04,03:28:54,10.0,golden_retriever,0.426183
683849932751646720,This is Jiminy. He's not the brightest dog. Needs to lay off the kibble. 5/10 still petable https://t.co/omln4LOy1x,Jiminy,https://pbs.twimg.com/media/Cx5R8wPVEAALa9r.jpg,3053.0,1195.0,3200952.0,,2016-01-04,03:18:23,5.0,cocker_spaniel,0.74022
683834909291606017,Here we see a faulty pupper. Might need to replace batteries. Try turning off &amp; back on again. 9/10 would still pet https://t.co/O1E4AtHVxO,None,https://pbs.twimg.com/media/Czhf4XtVQAAIqpd.jpg,3684.0,1533.0,3200952.0,pupper,2016-01-04,02:18:42,9.0,Airedale,0.4542390000000001
683828599284170753,Breathtaking pupper here. Should be on the cover of Dogue. Top-notch tongue. Appears considerably fluffy. 12/10 https://t.co/Eeh3yfdglS,None,https://pbs.twimg.com/media/Czky0v9VIAEXRkd.jpg,7162.0,3781.0,3200860.0,pupper,2016-01-04,01:53:37,12.0,toy_poodle,0.0369271
683773439333797890,This is Buddy. He's gaining strength. Currently an F4 tornado with wind speeds up to 260mph. Very devastating. 9/10 https://t.co/qipZbshNsR,Buddy,https://pbs.twimg.com/media/CzmSFlKUAAAQOjP.jpg,8058.0,3291.0,3200952.0,,2016-01-03,22:14:26,9.0,Rottweiler,0.36953
683742671509258241,Meet Sebastian. He's a womanizer. Romantic af. Always covered in flower petals. Also a poet. 11/10 dreamy as hell https://t.co/eoL1bCpWCg,Sebastian,https://pbs.twimg.com/media/CzpyM41UoAE1b2w.jpg,3469.0,1095.0,3200952.0,,2016-01-03,20:12:10,11.0,vizsla,0.911412
683515932363329536,HEY PUP WHAT'S THE PART OF THE HUMAN BODY THAT CONNECTS THE FOOT AND THE LEG? 11/10 so smart https://t.co/XQ1tRUmO3z,None,https://pbs.twimg.com/media/CzrtWDbWEAAmIhy.jpg,2878.0,1118.0,3200952.0,,2016-01-03,05:11:12,11.0,Pomeranian,0.8195110000000001
683498322573824003,This is Griffin. He's desperate for both a physical and emotion connection. 11/10 I'd hug the hell out of Griffin https://t.co/ObWcOEekt0,Griffin,https://pbs.twimg.com/media/Czu9RiwVEAA_Okk.jpg,2676.0,761.0,3200952.0,,2016-01-03,04:01:13,11.0,Greater_Swiss_Mountain_dog,0.375415
683481228088049664,Meet Banjo. He's a Peppercorn Shoop Da Whoop. Nails look lethal. Skeptical of luminescent orb 11/10 stay woke pupper https://t.co/H7NZFumpKq,Banjo,https://pbs.twimg.com/media/CwS4aqZXUAAe3IO.jpg,4290.0,1837.0,3200952.0,pupper,2016-01-03,02:53:17,11.0,Labrador_retriever,0.8616510000000001
683462770029932544,"""Hello forest pupper I am house pupper welcome to my abode"" (8/10 for both) https://t.co/qFD8217fUT",None,https://pbs.twimg.com/media/Cz1qo05XUAQ4qXp.jpg,8356.0,2702.0,3200952.0,pupper,2016-01-03,01:39:57,8.0,Norwich_terrier,0.397163
683449695444799489,I just want to be friends with this dog. Appears to be into the sports. A true brobean. 10/10 would introduce to mom https://t.co/1Z7Q6svWpe,None,https://pbs.twimg.com/media/Cz6Z0DgWIAAfdvp.jpg,3238.0,1059.0,3200952.0,,2016-01-03,00:47:59,10.0,Staffordshire_bullterrier,0.292556
683391852557561860,"Say hello to Jack (pronounced ""Kevin""). He's a Virgo Episcopalian. Can summon rainbows. 11/10 magical as hell https://t.co/YHXrdUTHd6",Jack,https://pbs.twimg.com/media/Cz61ZD4W8AAcJEU.jpg,3162.0,1173.0,3200952.0,,2016-01-02,20:58:09,11.0,malamute,0.620768
683357973142474752,"""Have a seat, son. There are some things we need to discuss"" 10/10 https://t.co/g4G5tvfTVd",None,https://pbs.twimg.com/media/C0AIwgVXAAAc1Ig.jpg,3736.0,1034.0,3200952.0,,2016-01-02,18:43:31,10.0,malamute,0.753521
683142553609318400,Meet Brandy. She's a member of the Bloods. Menacing criminal pupper. Soft spot for flowers tho. 9/10 pet w caution https://t.co/hhIA3coiAJ,Brandy,https://pbs.twimg.com/media/C0DhpcrUAAAnx88.jpg,2361.0,736.0,3200952.0,pupper,2016-01-02,04:27:31,9.0,flat-coated_retriever,0.8208040000000001
683111407806746624,This is Larry. He thought the New Year's parties were tonight. 10/10 poor pupper. Maybe next year https://t.co/h3X0jK8MVM,Larry,https://pbs.twimg.com/media/C0EyPZbXAAAceSc.jpg,2176.0,634.0,3200952.0,pupper,2016-01-02,02:23:45,10.0,golden_retriever,0.8713420000000001
683098815881154561,aahhhhkslaldhwnxmzbbs 12/10 for being da smooshiest https://t.co/UOPdXmUz4H,None,https://pbs.twimg.com/media/C0Kf9PtWQAEW4sE.jpg,2370.0,832.0,3200952.0,,2016-01-02,01:33:43,12.0,Pembroke,0.804177
683078886620553216,Here we see a nifty leaping pupper. Feet look deadly. Sad that the holidays are over. 9/10 undeniably huggable https://t.co/ny8mnXhGOW,None,https://pbs.twimg.com/media/C0N6opSXAAAkCtN.jpg,26239.0,15043.0,3200952.0,pupper,2016-01-02,00:14:32,9.0,beagle,0.39628
683030066213818368,This is Lulu. She's contemplating all her unreached 2015 goals and daydreaming of a more efficient tomorrow. 10/10 https://t.co/h3ScYuz77J,Lulu,https://pbs.twimg.com/media/C0PlCQjXAAA9TIh.jpg,1953.0,210.0,3200952.0,,2016-01-01,21:00:32,10.0,Pekinese,0.386082
682962037429899265,This is Darrel. He just robbed a 7/11 and is in a high speed police chase. Was just spotted by the helicopter 10/10 https://t.co/7EsP8LmSp5,Darrel,https://pbs.twimg.com/media/C0TAnZIUAAAADKs.jpg,2706.0,1258.0,3200952.0,,2016-01-01,16:30:13,7.0,Staffordshire_bullterrier,0.6105729999999999
682788441537560576,"Happy New Year from your fav holiday squad!  12/10 for all

Here's to a pupper-filled year  https://t.co/ZSdEj59FGf",None,https://pbs.twimg.com/media/C0Z2T_GWgAAxbL9.jpg,1440.0,397.0,3200952.0,pupper,2016-01-01,05:00:24,12.0,Great_Dane,0.0782055
682697186228989953,NAAAAAAA ZAPENYAAAAA MABADI-CHIBAWAAA 12/10 https://t.co/Ny4iM6FDtz,None,https://pbs.twimg.com/media/C0dSk98WEAALyya.jpg,2266.0,675.0,3200952.0,,2015-12-31,22:57:47,12.0,Irish_setter,0.326873
682662431982772225,Meet Joey and Izzy. Joey only has one ear that works and Izzy wants 2015 to be over already. Both great pups. 11/10s https://t.co/WgQTIQ93BB,Joey,https://pbs.twimg.com/media/C0eUHfWUAAANEYr.jpg,3769.0,1320.0,3200952.0,,2015-12-31,20:39:41,11.0,bull_mastiff,0.989316
682638830361513985,I have no words. Just a magnificent pup. 12/10 https://t.co/viwWHZgX8j,None,https://pbs.twimg.com/media/C0iKPZIXUAAbDYV.jpg,8319.0,2019.0,3200952.0,,2015-12-31,19:05:54,12.0,golden_retriever,0.914804
682429480204398592,"I know we joke around on here, but this is getting really frustrating. We rate dogs. Not T-Rex. Thank you... 8/10 https://t.co/5aFw7SWyxU",None,https://pbs.twimg.com/media/C0iX8OOVEAEIpMC.jpg,2441.0,773.0,3200952.0,,2015-12-31,05:14:01,8.0,toy_terrier,0.7764
682406705142087680,This is Patrick. He's a bigass pupper. 7/10 https://t.co/J9DXBFoAQe,Patrick,https://pbs.twimg.com/media/C0ilsa1XUAEHK_k.jpg,1828.0,518.0,3200952.0,pupper,2015-12-31,03:43:31,7.0,Doberman,0.909951
682393905736888321,This is Kreg. He's riding an invisible jet ski. 11/10 that's downright legendary https://t.co/BA5AV5dx6Y,Kreg,https://pbs.twimg.com/media/C0izZULWgAAKD-F.jpg,3389.0,1135.0,3200952.0,,2015-12-31,02:52:40,11.0,Great_Dane,0.128056
682389078323662849,"Meet Brody. He's a Downton Abbey Falsetto. Addicted to grating cheese. He says he can stop but we know he can't
9/10 https://t.co/vBeiQq6SaZ",Brody,https://pbs.twimg.com/media/C0jBJZVWQAA2_-X.jpg,4578.0,1375.0,3200952.0,,2015-12-31,02:33:29,9.0,Pembroke,0.140682
682303737705140231,This is Todo. He's screaming because he doesn't want to wear his sweater or a seat belt. 9/10 gotta buckle up pup https://t.co/Nm8Spw4HbD,Todo,https://pbs.twimg.com/media/C0jO6aBWEAAM28r.jpg,3566.0,1341.0,3200952.0,,2015-12-30,20:54:22,9.0,Norwegian_elkhound,0.432416
682259524040966145,Meet Jax. He's an Iglesias Hufflepoof. Quite the jokester. Takes it too far sometimes. Can be very hurtful. 9/10 https://t.co/i5TeG0KYcW,Jax,https://pbs.twimg.com/media/C0jcmOKVQAAd0VR.jpg,20108.0,11271.0,3200952.0,,2015-12-30,17:58:40,9.0,beagle,0.848735
682242692827447297,This is Samson. He patrols his waters on the back of his massive shielded battle dog. 11/10 https://t.co/f8dVgDYDFf,Samson,https://pbs.twimg.com/media/C0jqVVOXUAAGJ0G.jpg,5442.0,1915.0,3200952.0,,2015-12-30,16:51:48,11.0,Pembroke,0.07056710000000001
682088079302213632,I'm not sure what this dog is doing but it's pretty inspirational. 12/10 https://t.co/4Kn9GEHXiE,None,https://pbs.twimg.com/media/C0j4EESUsAABtMq.jpg,3525.0,1088.0,3200952.0,,2015-12-30,06:37:25,12.0,golden_retriever,0.0261931
682059653698686977,This is Tess. Her main passions are shelves and baking too many cookies. 11/10 https://t.co/IriJlVZ6m4,Tess,https://pbs.twimg.com/media/C0kFzOQUoAAt6yb.jpg,7223.0,2294.0,3200952.0,,2015-12-30,04:44:28,11.0,golden_retriever,0.888181
682047327939461121,We normally don't rate bears but this one seems nice. Her name is Thea. Appears rather fluffy. 10/10 good bear https://t.co/fZc7MixeeT,None,https://pbs.twimg.com/media/C0kTjqIXgAAqpRi.jpg,3464.0,1722.0,3200952.0,,2015-12-30,03:55:29,10.0,cocker_spaniel,0.701852
682032003584274432,This is Ulysses. He likes holding hands and his eyes are magic. 11/10 https://t.co/gPmJHmtgak,Ulysses,https://pbs.twimg.com/media/C0khWkVXEAI389B.jpg,3043.0,1161.0,3200952.0,,2015-12-30,02:54:35,11.0,Samoyed,0.905972
682003177596559360,Unique dog here. Wrinkly as hell. Weird segmented neck. Finger on fire. Doesn't seem to notice. 5/10 might still pet https://t.co/Hy9La4xNX3,None,https://pbs.twimg.com/media/C0szZh_XUAAm9je.jpg,2706.0,951.0,3200952.0,,2015-12-30,01:00:03,5.0,malamute,0.501159
681981167097122816,This is Jimothy. He's a Trinidad Poliwhirl. Father was a velociraptor. Exceptionally unamused. 12/10 would adopt https://t.co/VwdIk0OwVx,Jimothy,https://pbs.twimg.com/media/C0s-XtzWgAAp1W-.jpg,14010.0,4581.0,3200952.0,,2015-12-29,23:32:35,12.0,French_bulldog,0.709146
681891461017812993,Say hello to Charlie. He's scholarly af. Quite intimidating with all his pupper knowledge 10/10 even built that fire https://t.co/9KThv6z8u5,Charlie,https://pbs.twimg.com/media/C0uXObSXUAAIzmV.jpg,1923.0,499.0,3200952.0,pupper,2015-12-29,17:36:07,10.0,Siberian_husky,0.6993550000000001
681694085539872773,This is Bo. He's a Benedoop Cumbersnatch. Seems frustrated with own feet. Portable as hell. 11/10 very solid pupper https://t.co/TONMhRoQh7,Bo,https://pbs.twimg.com/media/Cveg1-NXgAASaaT.jpg,2903.0,1045.0,3200952.0,pupper,2015-12-29,04:31:49,11.0,Labrador_retriever,0.427742
681679526984871937,Can you spot Toby the guilty pupper? 7/10 would be higher but he made quite the mess shredding his stuffed pals https://t.co/3uCcDEJLXs,None,https://pbs.twimg.com/media/C0xz04SVIAAeyDb.jpg,2100.0,533.0,3200952.0,pupper,2015-12-29,03:33:58,7.0,golden_retriever,0.490068
681654059175129088,This is Toffee. He's a happy pupper. Appears dangerously fluffy. Extraordinarily spherical. 12/10 would pet firmly https://t.co/oEXEKt3MHu,Toffee,https://pbs.twimg.com/media/C03K2-VWIAAK1iV.jpg,3893.0,1489.0,3200952.0,pupper,2015-12-29,01:52:46,12.0,miniature_poodle,0.626913
681610798867845120,*collapses* 12/10 https://t.co/C7M8mnzHIK,None,https://pbs.twimg.com/media/C04taUjWIAA6Mo4.jpg,15749.0,6620.0,3200952.0,,2015-12-28,23:00:52,12.0,golden_retriever,0.650814
681579835668455424,This is Apollo. He thought you weren't coming back so he had a mental breakdown. 8/10 we've all been there https://t.co/ojUBrDCHLT,Apollo,https://pbs.twimg.com/media/C09p5dJWIAE5qKL.jpg,1803.0,313.0,3200952.0,,2015-12-28,20:57:50,8.0,dalmatian,0.999828
681340665377193984,I've been told there's a slight possibility he's checking his mirror. We'll bump to 9.5/10. Still a menace,None,https://pbs.twimg.com/media/C1G7sXyWIAA10eH.jpg,2918.0,863.0,3200952.0,,2015-12-28,05:07:27,9.5,German_shepherd,0.8179529999999999
681339448655802368,This is Asher. He's not wearing a seatbelt or keeping both paws on the wheel. Absolute menace on the roadways. 9/10 https://t.co/V3SWuHACkh,Asher,https://pbs.twimg.com/media/C1IT6rVXUAIvwYT.jpg,4347.0,2072.0,3200952.0,,2015-12-28,05:02:37,9.0,Border_collie,0.5489069999999999
681302363064414209,This is Chuck. He's a neat dog. Very flexible. Trapped in a glass case of emotion. Devastatingly unfluffy 3/10 https://t.co/YqbU9xHV3p,Chuck,https://pbs.twimg.com/media/C1L7OVVWQAIQ6Tt.jpg,3520.0,1258.0,3200952.0,,2015-12-28,02:35:15,3.0,Chihuahua,0.428756
681297372102656000,"This is actually a lion. We only rate dogs. For the last time please only send dogs. Thank u.
12/10 would still pet https://t.co/Pp26dMQxap",None,https://pbs.twimg.com/media/CiibOMzUYAA9Mxz.jpg,1597.0,308.0,3200860.0,,2015-12-28,02:15:26,12.0,English_setter,0.677408
681281657291280384,Meet Sarge. His parents signed him up for dancing lessons but his true passion is roller coasters 11/10 very petable https://t.co/KvVoBIgkje,Sarge,https://pbs.twimg.com/media/C1NXQ6NXUAEAxIQ.jpg,1645.0,624.0,3200952.0,,2015-12-28,01:12:59,11.0,Pomeranian,0.967345
681261549936340994,Say hello to Panda. He's a Quackadilly Shooster. Not amused by your fake ball throwing motion. 9/10 would hug lots https://t.co/wL1iDvbcVk,Panda,https://pbs.twimg.com/media/C1Q17WdWEAAjKFO.jpg,2629.0,540.0,3200952.0,,2015-12-27,23:53:05,9.0,Labrador_retriever,0.91933
681231109724700672,I just love this pic. 11/10 this pupper is going places https://t.co/P16uhh1PbI,None,https://pbs.twimg.com/media/C1V-K63UAAEUHqw.jpg,2665.0,749.0,3200952.0,pupper,2015-12-27,21:52:07,11.0,Chihuahua,0.756992
681193455364796417,This is Aspen. He's astronomically fluffy. I wouldn't stop petting this dog if the world was ending around me 11/10 https://t.co/oBlgL9nxpx,Aspen,https://pbs.twimg.com/media/C1XqbhXXUAElpfI.jpg,4986.0,2243.0,3200952.0,,2015-12-27,19:22:30,11.0,malamute,0.668164
680970795137544192,I thought I made this very clear. We only rate dogs. Stop sending other things like this shark. Thank you... 9/10 https://t.co/CXSJZ4Stk3,None,https://pbs.twimg.com/media/CvoBPWRWgAA4het.jpg,3544.0,1225.0,3200952.0,,2015-12-27,04:37:44,9.0,golden_retriever,0.245773
680959110691590145,This is Ozzie. He was doing fine until he lost traction in those festive socks. Now he's tired. 9/10 still killin it https://t.co/u4FYdIRKnY,Ozzie,https://pbs.twimg.com/media/C1bEl4zVIAASj7_.jpg,2285.0,497.0,3200952.0,,2015-12-27,03:51:18,9.0,kelpie,0.8644149999999999
680940246314430465,This is Alice. She's an idiot. 4/10 https://t.co/VQXdwJfkyS,Alice,https://pbs.twimg.com/media/C1b_LSYUsAAJ494.jpg,2609.0,705.0,3200952.0,,2015-12-27,02:36:20,4.0,Saluki,0.568809
680934982542561280,Say hello to Sadie. She's a Tortellini Sidewinder. Very jubilant pup. Seems loyal. Leaves on point. 10/10 petable af https://t.co/g2bTu4ayPl,Sadie,https://pbs.twimg.com/media/C1cs8uAWgAEwbXc.jpg,1945.0,418.0,3200952.0,,2015-12-27,02:15:25,10.0,golden_retriever,0.295483
680913438424612864,Meet Griswold. He's dapper as hell. Already pumped for next Christmas. 11/10 https://t.co/5NrpNDyFzN,Griswold,https://pbs.twimg.com/ext_tw_video_thumb/815965888126062592/pu/img/JleSw4wRhgKDWQj5.jpg,3766.0,1513.0,3200952.0,,2015-12-27,00:49:49,11.0,Tibetan_mastiff,0.506312
680889648562991104,This is Cheesy. It's her birthday. She's patiently waiting to eat her party muffin. 9/10 happy birthday pup https://t.co/cH2H7mch2H,Cheesy,https://pbs.twimg.com/media/C1gLJVpWgAApI3r.jpg,2370.0,751.0,3200952.0,,2015-12-26,23:15:17,9.0,Doberman,0.806163
680805554198020098,This guy's dog broke. So sad. 9/10 would still pet https://t.co/BYiXJDEzv7,None,https://pbs.twimg.com/media/C1h4_MEXUAARxQF.jpg,3134.0,1182.0,3200952.0,,2015-12-26,17:41:07,9.0,pug,0.971358
680801747103793152,Great picture here. Dog on the right panicked &amp; forgot about his tongue. Middle green dog must've fainted. All 10/10 https://t.co/31npKUAox0,None,https://pbs.twimg.com/ext_tw_video_thumb/817777588030476288/pu/img/KbuLpE4krHF4VdPf.jpg,2906.0,816.0,3200952.0,,2015-12-26,17:25:59,10.0,curly-coated_retriever,0.733256
680798457301471234,Say hello to Moofasa. He must be a powerful dog. Fenced in for your protection. Just got his ear pierced. 6/10 https://t.co/w6fRfQ3RXD,Moofasa,https://pbs.twimg.com/ext_tw_video_thumb/817827663108771841/pu/img/e9oi839RGWJR37jF.jpg,3939.0,1514.0,3200952.0,,2015-12-26,17:12:55,6.0,cocker_spaniel,0.387608
680609293079592961,This is Brody. That is his chair. He loves his chair. Never leaves it. 9/10 might be stuck actually https://t.co/WvJRg0XJit,Brody,https://pbs.twimg.com/media/C1qi26rW8AMaj9K.jpg,4639.0,2162.0,3200952.0,,2015-12-26,04:41:15,9.0,golden_retriever,0.621931
