tweet_id,text,name,jpg_url,favorite_count,retweet_count,user_count,dog_stage,date,time,rating,dog_breed,conf_lvl
800018252395122689,Here's a doggo doin a struggle. 11/10 much determined https://t.co/gQqRBfkX4I,None,https://pbs.twimg.com/media/CWxDaXHWsAAWV8W.jpg,0.0,5488.0,3200898.0,doggo,2016-11-19,16:49:49,11.0,Eskimo_dog,0.330216
799422933579902976,This is Longfellow (prolly sophisticated). He's a North Appalachian Oatzenjammer. Concerned about wrinkled feets. 12/10 would hug softly https://t.co/bpLuQuxzHZ,Longfellow,https://pbs.twimg.com/ext_tw_video_thumb/679111114081370114/pu/img/hFca8BHjRopgD0cM.jpg,0.0,6478.0,3200898.0,,2016-11-18,01:24:14,12.0,kelpie,0.189423
799297110730567681,This is Jeffrey. He's quite the jokester. Takes it too far sometimes. Still 11/10 would pet https://t.co/YDtZcAiMAf,Jeffrey,https://pbs.twimg.com/media/CWzSMmAWsAAyB1u.jpg,9058.0,2863.0,3200898.0,,2016-11-17,17:04:16,11.0,Italian_greyhound,0.302685
798933969379225600,This is Iroh. He's in a predicament. 12/10 someone help him https://t.co/KJAKO2kXsL,Iroh,https://pbs.twimg.com/media/CW3v1KxW8AAIOuy.jpg,8246.0,1663.0,3200898.0,,2016-11-16,17:01:16,12.0,toy_poodle,0.62178
798925684722855936,This is Shadow. He's a firm believer that they're all good dogs. H*ckin passionate about it too. 11/10 I stand with Shadow https://t.co/8yvpacwBcu,Shadow,https://pbs.twimg.com/media/CW37xZbUoAAUXe5.jpg,0.0,7724.0,3200898.0,,2016-11-16,16:28:21,11.0,Maltese_dog,0.145742
798209839306514432,This is Cooper. His bow tie was too heavy for the front so he moved it to the side. Balanced af now. 13/10 https://t.co/jG1PAFkB81,Cooper,https://pbs.twimg.com/media/CW-ZRC_WQAAyFrL.jpg,13018.0,3652.0,3200900.0,,2016-11-14,17:03:50,13.0,Samoyed,0.995466
797971864723324932,Here's a helicopter pupper. He takes off at random. H*ckin hard to control. 12/10 rare af https://t.co/GRWPgNKt2z,None,https://pbs.twimg.com/media/CW-dU34WQAANBGy.jpg,16198.0,5656.0,3200900.0,pupper,2016-11-14,01:18:12,12.0,Shih-Tzu,0.121811
797236660651966464,This is Pancake. She loves Batman and winks like a h*ckin champ. 12/10 real crowd pleaser https://t.co/6kqsAjJNhi,Pancake,https://pbs.twimg.com/media/CW-loUBWYAAn2Cb.jpg,256.0,32.0,3200900.0,,2016-11-12,00:36:46,12.0,golden_retriever,0.6989609999999999
797165961484890113,@JODYHiGHROLLER it may be an 11/10 but what do I know ,None,https://pbs.twimg.com/media/CXBBurSWMAELewi.jpg,0.0,10411.0,3200900.0,,2016-11-11,19:55:50,11.0,pug,0.999365
796865951799083009,This is Tyr. He's just checking on you. Nifty af tongue slip. 12/10 would absolutely pet https://t.co/Jgnuiyvq06,Tyr,https://pbs.twimg.com/media/CXBdJxLUsAAWql2.jpg,13256.0,3562.0,3200900.0,,2016-11-11,00:03:42,12.0,miniature_poodle,0.457117
796759840936919040,Say hello to Romeo. He was just told that it's too cold for the pool. H*ckin nonsense. 11/10 would help fill up https://t.co/6hx7ur6sNI,Romeo,https://pbs.twimg.com/media/CXBq6RPWkAAaNuU.jpg,0.0,8536.0,3200900.0,,2016-11-10,17:02:03,11.0,bluetick,0.268681
796484825502875648,Here's a sleepy doggo that requested some assistance. 12/10 would carry everywhere https://t.co/bvkkqOjNDV,None,https://pbs.twimg.com/media/CXCGVXyWsAAAVHE.jpg,12334.0,4861.0,3200900.0,doggo,2016-11-09,22:49:15,12.0,Brittany_spaniel,0.7332529999999999
796125600683540480,"#ImWithThor 13/10
https://t.co/a18mzkhTf6",None,https://pbs.twimg.com/media/CXGGlzvWYAArPfk.jpg,10139.0,2813.0,3200900.0,,2016-11-08,23:01:49,13.0,Lakeland_terrier,0.796694
796116448414461957,I didn't believe it at first but now I can see that voter fraud is a serious h*ckin issue. 11/10 https://t.co/7i0bDMbrVN,None,https://pbs.twimg.com/media/CXGaVxOWAAADjhF.jpg,9469.0,2703.0,3200900.0,,2016-11-08,22:25:27,11.0,kuvasz,0.438627
796080075804475393,This is Yogi. He's 98% floof. Snuggable af. 12/10 https://t.co/opoXKxmfFm,Yogi,https://pbs.twimg.com/media/CXGdG0aWcAEbOO1.jpg,12071.0,4284.0,3200900.0,,2016-11-08,20:00:55,12.0,Chihuahua,0.538354
795464331001561088,Elder doggo does a splash. Both 13/10 incredible stuff https://t.co/gBUDjdEcqz,None,https://pbs.twimg.com/media/CXICiB9UwAE1sKY.jpg,11270.0,3323.0,3200900.0,doggo,2016-11-07,03:14:10,13.0,French_bulldog,0.700764
795076730285391872,This is Bailey. She loves going down slides but is very bad at it. Still 11/10 https://t.co/ivPWhspN3E,Bailey,https://pbs.twimg.com/media/CXKxkseW8AAjAMY.jpg,0.0,3942.0,3200900.0,,2016-11-06,01:33:58,11.0,pug,0.99672
794926597468000259,This is Mack. He's rather h*ckin sleepy. Exceptional ears. 12/10 would boop https://t.co/XRPvTPF0VH,Mack,https://pbs.twimg.com/media/CXMBhXfWEAA4mMI.jpg,0.0,12014.0,3200900.0,,2016-11-05,15:37:24,12.0,Shetland_sheepdog,0.876337
794332329137291264,This is Nimbus (like the cloud). He just bought this fancy af duck raincoat. Only protects one ear tho. 12/10 so h*ckin floofy https://t.co/SIQbb8c3AU,Nimbus,https://pbs.twimg.com/media/CXMqwIQWcAA2iE0.jpg,10314.0,3895.0,3200900.0,,2016-11-04,00:15:59,12.0,Labrador_retriever,0.7843979999999999
794205286408003585,This is Laika. She was a space pupper. The first space pupper actually. Orbited earth like a h*ckin boss. 14/10 hero af https://t.co/trSjgY3h4g,Laika,https://pbs.twimg.com/media/CXMvio7WQAAPZJj.jpg,18910.0,5711.0,3200900.0,pupper,2016-11-03,15:51:10,14.0,soft-coated_wheaten_terrier,0.289598
793962221541933056,This is Maximus. His face is stuck like that. Tragic really. Great tongue tho. 12/10 would pet firmly https://t.co/xIfrsMNLBR,Maximus,https://pbs.twimg.com/media/CXNAsm6WsAEST9R.jpg,10295.0,2187.0,3200900.0,,2016-11-02,23:45:19,12.0,pug,0.0443565
793845145112371200,This is Clark. He was just caught wearing pants. 13/10 game-changing af https://t.co/2Xo19aPrG5,Clark,https://pbs.twimg.com/media/CXNLU6wWkAE0OkJ.jpg,0.0,3661.0,3200900.0,,2016-11-02,16:00:06,13.0,pug,0.713102
793601777308463104,This is Dobby. I can't stop looking at her feet. 12/10 would absolutely snug https://t.co/LhzPWv6rTv,Dobby,https://pbs.twimg.com/media/CXQ4EwQWwAEVaUf.jpg,11953.0,2786.0,3200900.0,,2016-11-01,23:53:02,12.0,Irish_setter,0.406047
793286476301799424,This is Moreton. He's the Good Boy Who Lived. 13/10 magical as h*ck https://t.co/rLHGx3VAF3,Moreton,https://pbs.twimg.com/media/CXRTw_5WMAAUDVp.jpg,9677.0,2763.0,3200900.0,,2016-11-01,03:00:09,13.0,Tibetan_terrier,0.382101
793271401113350145,Meet Dave. It's his favorite day of the year. He gets to fulfill his dream of being a dinosaur. 12/10 inspirational af https://t.co/MgQSdfZGPN,Dave,https://pbs.twimg.com/media/CXRmDfWWMAADCdc.jpg,22350.0,9714.0,3200901.0,,2016-11-01,02:00:14,12.0,Saint_Bernard,0.99883
793256262322548741,Oh h*ck look at this spookling right here. Fright level off the charts. 12/10 sufficiently spooked https://t.co/BNy9IIJMb0,None,https://pbs.twimg.com/media/CXR0WJ_W8AMd_O8.jpg,11780.0,3812.0,3200901.0,,2016-11-01,01:00:05,12.0,Lhasa,0.482401
793226087023144960,"This is Juno. She spooked me up real good, but only to get my attention. Above average handwriting for a dog I think. 11/10 https://t.co/hFxxBCWlwj",Juno,https://pbs.twimg.com/media/CXSJGAQUQAAoG9Q.jpg,9997.0,3301.0,3200901.0,,2016-10-31,23:00:11,11.0,Samoyed,0.362596
793210959003287553,This is Maude. She's the h*ckin happiest wasp you've ever seen. 10/10 would pet with caution https://t.co/etL8FHBrh8,Maude,https://pbs.twimg.com/media/CXSanNkWkAAqR9M.jpg,17063.0,6547.0,3200901.0,,2016-10-31,22:00:04,10.0,Labrador_retriever,0.0946149
793195938047070209,Say hello to Lily. She's pupset that her costume doesn't fit as well as last year. 12/10 poor puppo https://t.co/YSi6K1firY,Lily,https://pbs.twimg.com/media/CXVBtX_WwAEuqbP.jpg,7740.0,2310.0,3200901.0,puppo,2016-10-31,21:00:23,12.0,Norfolk_terrier,0.205067
793180763617361921,This is Newt. He's a strawberry. 11/10 https://t.co/2VhmlwxA1Q,Newt,https://pbs.twimg.com/media/CXV1Ot_W8AEpkQO.jpg,10478.0,3238.0,3200901.0,,2016-10-31,20:00:05,11.0,Rottweiler,0.760671
793165685325201412,This is Benji. He's Air Bud. It's a low effort costume but he pulls it off rather h*ckin well. 12/10 would happily get dunked on https://t.co/IbzT7DJvBo,Benji,https://pbs.twimg.com/media/CXWRZBgWkAEHMea.jpg,6909.0,1984.0,3200901.0,,2016-10-31,19:00:10,12.0,toy_poodle,0.8217040000000001
793150605191548928,This is Nida. She's a free elf. Waited so long for this day. 11/10 https://t.co/3lE8Izgmkf,Nida,https://pbs.twimg.com/media/CXW4wGHWsAE_eBD.jpg,7214.0,2893.0,3200901.0,,2016-10-31,18:00:14,11.0,Pomeranian,0.800538
793120401413079041,"This is Robin. She's desperately trying to do me a frighten, but her tongue drastically decreases her spook value. Still 11/10 great effort https://t.co/sxMrsOZ8zb",Robin,https://pbs.twimg.com/media/CXXdJ7CVAAALu23.jpg,16063.0,4715.0,3200901.0,,2016-10-31,16:00:13,11.0,toy_poodle,0.920992
792913359805018113,Here is a perfect example of someone who has their priorities in order. 13/10 for both owner and Forrest https://t.co/LRyMrU7Wfq,None,https://pbs.twimg.com/media/CXaQqGbWMAAKEgN.jpg,12666.0,4964.0,3200901.0,,2016-10-31,02:17:31,13.0,Chihuahua,0.20357
792883833364439040,This is Bailey. She's rather h*ckin hype for Halloween tomorrow. Carved those pupkins herself. 12/10 https://t.co/v17mFm0Ftz,Bailey,https://pbs.twimg.com/media/CXbiQHmWcAAt6Lm.jpg,8209.0,1963.0,3200901.0,,2016-10-31,00:20:11,12.0,Labrador_retriever,0.4525770000000001
792394556390137856,Meet BeBe. She rocks the messy bun of your dreams. H*ckin flawless. 12/10 would watch her tutorial https://t.co/of0pFNBIl8,BeBe,https://pbs.twimg.com/media/CXcQfUNUQAEwFoQ.jpg,8029.0,2088.0,3200901.0,,2016-10-29,15:55:58,12.0,schipperke,0.997953
791774931465953280,Vine will be deeply missed. This was by far my favorite one. 14/10 https://t.co/roqIxCvEB3,None,https://pbs.twimg.com/media/CXgHoLnWAAA8i52.jpg,13129.0,3661.0,3200901.0,,2016-10-27,22:53:48,14.0,Lakeland_terrier,0.00173092
791672322847637504,When she says you're a good boy and you know you're a good boy because you're a good boy. 13/10 https://t.co/O5IUmRHRIh,None,https://pbs.twimg.com/media/CXhVKtvW8AAyiyK.jpg,14670.0,4797.0,3200901.0,,2016-10-27,16:06:04,13.0,curly-coated_retriever,0.482288
791406955684368384,Say hello to Levi. He's a Madagascan Butterbop. One of the more docile Butterbops I've seen. 12/10 would give all the pets https://t.co/Zcw9Sccctc,Levi,https://pbs.twimg.com/media/CXhZom1UwAA4Zz6.jpg,9841.0,2963.0,3200901.0,,2016-10-26,22:31:36,12.0,vizsla,0.657275
790987426131050500,This is Misty. She has a cowboy hat on her nose. 12/10 https://t.co/Eno0mypHIr,Misty,https://pbs.twimg.com/media/CXk4W0qWYAMEMEs.jpg,18601.0,5496.0,3200901.0,,2016-10-25,18:44:32,12.0,English_springer,0.440781
790946055508652032,This is Betty. She's assisting with the dishes. Such a good puppo. 12/10 h*ckin helpful af https://t.co/dgvTPZ9tgI,Betty,https://pbs.twimg.com/media/CXlN1-EWMAQdwXK.jpg,0.0,2704.0,3200901.0,puppo,2016-10-25,16:00:09,12.0,beagle,0.413824
790698755171364864,This is Mosby. He appears to be rather h*ckin snuggable af. 12/10 keep it up Mosby https://t.co/IiiBq460I7,Mosby,https://pbs.twimg.com/media/CXmd_bsWkAEEXck.jpg,22473.0,8183.0,3200901.0,,2016-10-24,23:37:28,12.0,English_setter,0.947198
790337589677002753,Meet Maggie. She can hear your cells divide. 12/10 can also probably fly https://t.co/ovE2hqXryV,Maggie,https://pbs.twimg.com/media/CXpeVzQW8AApKYb.jpg,14081.0,3732.0,3200901.0,,2016-10-23,23:42:19,12.0,Chihuahua,0.15520699999999998
790277117346975746,This is Bruce. He never backs down from a challenge. 11/10 you got this Bruce https://t.co/aI7umZHIq7,Bruce,https://pbs.twimg.com/media/CXqcOHCUQAAugTB.jpg,0.0,4190.0,3200901.0,,2016-10-23,19:42:02,11.0,boxer,0.722218
789986466051088384,This is Happy. He's a bathtub reviewer. Seems to be pleased with this one. 12/10 https://t.co/Ln89R4FP7v,Happy,https://pbs.twimg.com/media/CXrawAhWkAAWSxC.jpg,0.0,4839.0,3200901.0,,2016-10-23,00:27:05,12.0,golden_retriever,0.889848
789903600034189313,This is Ralphy. His dreams were just shattered. Poor pupper. 13/10 it'll be ok Ralphy https://t.co/P0kSN6rT6H,Ralphy,https://pbs.twimg.com/media/CXsChyjW8AQJ16C.jpg,8448.0,2080.0,3200901.0,pupper,2016-10-22,18:57:48,13.0,Leonberg,0.605851
789628658055020548,This is Eli. He can fly. 13/10 magical af https://t.co/huPSJJ7FDI,Eli,https://pbs.twimg.com/media/CXvGbWeWMAcRbyJ.jpg,7620.0,2279.0,3200901.0,,2016-10-22,00:45:17,13.0,Pembroke,0.406509
789599242079838210,This is Brownie. She's wearing a Halloween themed onesie. 12/10 festive af https://t.co/0R4meWXFOx,Brownie,https://pbs.twimg.com/media/CXvlQ2zW8AAE0tp.jpg,13188.0,3942.0,3200901.0,,2016-10-21,22:48:24,12.0,French_bulldog,0.992833
789530877013393408,This is Rizzy. She smiles a lot. 12/10 contagious af https://t.co/TU4sZogVIq,Rizzy,https://pbs.twimg.com/media/CXwZ3pbWsAAriTv.jpg,9615.0,2666.0,3200901.0,,2016-10-21,18:16:44,12.0,Lakeland_terrier,0.303512
789314372632018944,"HE WAS JUST A LIL SLEEPY FROM BEING SUCH A GOOD DOGGI ALL THE TIME MISTAKES HAPPEN 13/10
https://t.co/G2ms0A5jWM",None,https://pbs.twimg.com/media/CXwlw9MWsAAc-JB.jpg,0.0,5747.0,3200901.0,,2016-10-21,03:56:25,13.0,Italian_greyhound,0.39956
789268448748703744,This is Stella. She's happier than I will ever be. 10/10 would trade lives with https://t.co/JSs2bfDtTS,Stella,https://pbs.twimg.com/media/CXxGGOsUwAAr62n.jpg,10875.0,3244.0,3200901.0,,2016-10-21,00:53:56,10.0,Airedale,0.945362
789137962068021249,This is Bo. He's a West Congolese Bugaboop Snuggle. Rather exotic. Master of the head tilt. 12/10 would pay to pet https://t.co/2jwxxtNzoN,Bo,https://pbs.twimg.com/media/CX0kVRxWYAAWWZi.jpg,30653.0,14409.0,3200901.0,,2016-10-20,16:15:26,12.0,Pembroke,0.895279
788908386943430656,"This is Lucy. She destroyed not one, but two remotes trying to turn off the debate. 11/10 relatable af https://t.co/3BXh073tDm",Lucy,https://pbs.twimg.com/media/CX1AUQ2UAAAC6s-.jpg,30658.0,12014.0,3200901.0,,2016-10-20,01:03:11,11.0,miniature_pinscher,0.0728852
788765914992902144,This is Butter. She can have whatever she wants forever. 12/10 would hug softly https://t.co/x5gXRS1abq,Butter,https://pbs.twimg.com/media/CX1ye7HUMAADDzh.jpg,0.0,8407.0,3200901.0,,2016-10-19,15:37:03,12.0,malamute,0.577376
788412144018661376,This is Dexter. He breaks hearts for a living. 11/10 h*ckin handsome af https://t.co/4DhSsC1W7S,Dexter,https://pbs.twimg.com/media/CX2F4qNUQAAR6Cm.jpg,8100.0,2488.0,3200901.0,,2016-10-18,16:11:17,11.0,Mexican_hairless,0.164906
788178268662984705,Atlas is back and this time he's got doggles. Still 13/10 solarly conscious af https://t.co/s7MgFWDySc,None,https://pbs.twimg.com/media/CX2ISqSWYAAEtCF.jpg,6865.0,1510.0,3200901.0,,2016-10-18,00:41:57,13.0,toy_poodle,0.5513520000000001
788150585577050112,This is Leo. He's a golden chow. Rather h*ckin rare. 13/10 would give extra pats https://t.co/xosHjFzVXc,Leo,https://pbs.twimg.com/media/CX2NJmRWYAAxz_5.jpg,0.0,3952.0,3200901.0,,2016-10-17,22:51:57,13.0,bluetick,0.174738
787810552592695296,This is Frank. He wears sunglasses and walks himself. 11/10 I'll never be this cool or independent https://t.co/pNNjBtHWPc,Frank,https://pbs.twimg.com/media/CX6v_JOWsAE0beZ.jpg,11416.0,3240.0,3200901.0,,2016-10-17,00:20:47,11.0,chow,0.334783
787717603741622272,This is Tonks. She is a service puppo. Can hear a caterpillar hiccup from 7 miles away. 13/10 would follow anywhere https://t.co/i622ZbWkUp,Tonks,https://pbs.twimg.com/media/CX66EiJWkAAVjA-.jpg,12120.0,3300.0,3200901.0,puppo,2016-10-16,18:11:26,13.0,kelpie,0.537782
787397959788929025,This is Moose. He's rather h*ckin dangerous (you can tell by the collar). 11/10 would still attempt to snug https://t.co/lHVHGdDzb3,Moose,https://pbs.twimg.com/media/CX6_y6OU0AAl3v2.jpg,8726.0,2032.0,3200901.0,,2016-10-15,21:01:17,11.0,Chihuahua,0.379365
786963064373534720,This is Rory. He's got an interview in a few minutes. Looking spiffy af. Nervous as h*ck tho. 12/10 would hire https://t.co/ibj5g6xaAj,Rory,https://pbs.twimg.com/media/CX7br3HWsAAQ9L1.jpg,0.0,2827.0,3200901.0,,2016-10-14,16:13:10,12.0,golden_retriever,0.203249
786709082849828864,"This is Logan, the Chow who lived. He solemnly swears he's up to lots of good. H*ckin magical af 9.75/10 https://t.co/yBO5wuqaPS",Logan,https://pbs.twimg.com/media/CX-wzZEUwAA4ISM.jpg,11957.0,2996.0,3200901.0,,2016-10-13,23:23:56,9.75,Labrador_retriever,0.673691
786664955043049472,"""Honestly Kathleen I just want more Ken Bone"" 12/10 https://t.co/HmlEvAMP4r",None,https://pbs.twimg.com/media/CX_D6AJWwAAnBIw.jpg,10497.0,3601.0,3200901.0,,2016-10-13,20:28:35,12.0,Chihuahua,0.93781
786595970293370880,This is Dale. He's a real spookster. Did me quite the frighten. 11/10 not too spooky to pet tho https://t.co/L8BWDD4oBX,Dale,https://pbs.twimg.com/ext_tw_video_thumb/684538367950872576/pu/img/kTKOkSU45BS-fpq8.jpg,12189.0,4072.0,3200901.0,,2016-10-13,15:54:28,11.0,Chihuahua,0.702583
786286427768250368,This is Arnie. He's afraid of his own bark. 12/10 would comfort https://t.co/ObT2tSxXit,Arnie,https://pbs.twimg.com/media/CYAra7JWsAACPZH.jpg,17178.0,5571.0,3200901.0,,2016-10-12,19:24:27,12.0,Weimaraner,0.948688
786233965241827333,This is Mattie. She's extremely dangerous. Will bite your h*ckin finger right off. Still 11/10 would pet with caution https://t.co/78c9W8kLFh,Mattie,https://pbs.twimg.com/media/CYDmK7ZVAAI_ylL.jpg,1614.0,179.0,3200901.0,,2016-10-12,15:55:59,11.0,miniature_schnauzer,0.294457
785927819176054784,This is Lucy. She's strives to be the best potato she can be. 12/10 would boop https://t.co/lntsj7Fc4Y,Lucy,https://pbs.twimg.com/media/CYFOP6cWEAAWp-k.jpg,7489.0,2130.0,3200901.0,,2016-10-11,19:39:28,12.0,chow,0.261288
785872687017132033,Meet Rusty. He appears to be rather h*ckin fluffy. Also downright adorable af. 12/10 would rub my face against his https://t.co/1j9kLGb4wV,Rusty,https://pbs.twimg.com/media/CYFZXdiU0AAc_kw.jpg,8735.0,2561.0,3200901.0,,2016-10-11,16:00:24,12.0,Labrador_retriever,0.769412
785639753186217984,This is Pinot. He's a sophisticated doggo. You can tell by the hat. Also pointier than your average pupper. Still 10/10 would pet cautiously https://t.co/f2wmLZTPHd,Pinot,https://pbs.twimg.com/media/CYFlVUFWwAAEsWX.jpg,10183.0,2334.0,3200901.0,doggo,2016-10-11,00:34:48,10.0,Border_collie,0.665578
785515384317313025,"Today, 10/10, should be National Dog Rates Day",None,https://pbs.twimg.com/media/CYI10WhWsAAjzii.jpg,8128.0,1911.0,3200901.0,,2016-10-10,16:20:36,10.0,Bernese_mountain_dog,0.975096
785264754247995392,This is Doc. He requested to be carried around like that. 12/10 anything for Doc https://t.co/mWYACm4qnx,Doc,https://pbs.twimg.com/media/CYJQxvJW8AAkkws.jpg,13491.0,5639.0,3200901.0,,2016-10-09,23:44:41,12.0,Old_English_sheepdog,0.00967138
785170936622350336,This is Hero. He was enjoying the car ride until he remembered that bees are dying globally at an alarming rate. 11/10 https://t.co/cubFg7F4qQ,Hero,https://pbs.twimg.com/media/CYKQS0xUQAEOptC.jpg,11310.0,3712.0,3200901.0,,2016-10-09,17:31:53,11.0,pug,0.999044
784826020293709826,This is Rusty. He's going D1 for sure. Insane vertical. 13/10 would draft https://t.co/AsykOwMrXQ,Rusty,https://pbs.twimg.com/media/CYKzfTTWMAEeTN7.jpg,10039.0,2970.0,3200901.0,,2016-10-08,18:41:19,13.0,Pomeranian,0.963176
784517518371221505,This is Frankie. He has yet to learn how to control his tongue. 11/10 maybe one day https://t.co/p6fgYe2dB6,Frankie,https://pbs.twimg.com/media/CYK6kf0WMAAzP-0.jpg,6329.0,1491.0,3200901.0,,2016-10-07,22:15:26,11.0,chow,0.470162
784431430411685888,This is Stormy. He's curly af. Already pupared for Coachella next year. 12/10 https://t.co/PHA1vtqqpt,Stormy,https://pbs.twimg.com/media/CYLAWFMWMAEcRzb.jpg,22513.0,9374.0,3200901.0,,2016-10-07,16:33:21,12.0,Boston_bull,0.972483
784057939640352768,This is Balto. He's very content. Legendary tongue slippage. 12/10 would pet forever https://t.co/T7Jr4Gw4sC,Balto,https://pbs.twimg.com/media/CYN_-6iW8AQhPu2.jpg,33689.0,12643.0,3200901.0,,2016-10-06,15:49:14,12.0,collie,0.0958052
783821107061198850,This is Mairi. She has mastered the art of camouflage. 12/10 h*ckin sneaky af https://t.co/STcPjiNAHp,Mairi,https://pbs.twimg.com/media/CYPjvFqW8AAgiP2.jpg,11650.0,3737.0,3200901.0,,2016-10-06,00:08:09,12.0,Lakeland_terrier,0.253839
783695101801398276,This is Loomis. He's the leader of the Kenneth search party. The passion is almost overwhelming. 12/10 one day he will be free https://t.co/kCRKlFg4AY,Loomis,https://pbs.twimg.com/ext_tw_video_thumb/685663358637486080/pu/img/3cXSHFZAgJQ_dDCf.jpg,9468.0,2608.0,3200901.0,,2016-10-05,15:47:27,12.0,Chesapeake_Bay_retriever,0.171174
783391753726550016,Meet Godi. He's an avid beachgoer and part time rainbow summoner. Eyeliner flawless af. 13/10 would snug well https://t.co/BO936YdJdi,Godi,https://pbs.twimg.com/media/CYTUhn7WkAEXocW.jpg,0.0,6533.0,3200901.0,,2016-10-04,19:42:03,13.0,Yorkshire_terrier,0.414963
783334639985389568,This is Dave. He's currently in a predicament. Doesn't seem to mind tho. 12/10 someone assist Dave https://t.co/nfprKAXqwu,Dave,https://pbs.twimg.com/media/CYURBGoWYAAKey3.jpg,9112.0,2565.0,3200901.0,,2016-10-04,15:55:06,12.0,Siberian_husky,0.450678
782969140009107456,This is Cali. She arrived preassembled. Convenient af. 12/10 appears to be rather h*ckin pettable https://t.co/vOBV1ZqVcX,Cali,https://pbs.twimg.com/media/CYUwjz-UAAEcdi8.jpg,8310.0,1604.0,3200901.0,,2016-10-03,15:42:44,12.0,Rhodesian_ridgeback,0.885301
782747134529531904,This is Deacon. He's the happiest almost dry doggo I've ever seen. 11/10 would smile back https://t.co/C6fUMnHt1H,Deacon,https://pbs.twimg.com/media/CYVIToGWQAAEZ_y.jpg,19250.0,6238.0,3200901.0,doggo,2016-10-03,01:00:34,11.0,Great_Dane,0.23692
782722598790725632,"This is Penny. She fought a bee and the bee won. 10/10 you're fine Penny, everything's fine https://t.co/zrMVdfFej6",Penny,https://pbs.twimg.com/media/CYVXBb9WsAAwL3p.jpg,8694.0,2184.0,3200901.0,,2016-10-02,23:23:04,10.0,Pomeranian,0.985789
782598640137187329,This is Timmy. He's quite large. According to a trusted source it's actually a dog wearing a dog suit. 11/10 https://t.co/BIUchFwHqn,Timmy,https://pbs.twimg.com/media/CYZvRttWYAE_RXc.jpg,18630.0,6470.0,3200901.0,,2016-10-02,15:10:30,11.0,pug,0.985237
782305867769217024,This is Sampson. He just graduated. Ready to be a doggo now. Time for the real world. 12/10 have fun with taxes https://t.co/pgVKxRw0s1,Sampson,https://pbs.twimg.com/media/CYaAS2kUoAINkye.jpg,0.0,7236.0,3200901.0,doggo,2016-10-01,19:47:08,12.0,German_shepherd,0.830816
781955203444699136,This is Chipson. He weighed in at .3 ounces and is officially super h*ckin smol. Space-saving af. 11/10 would snug delicately https://t.co/FjEsk7A1JV,Chipson,https://pbs.twimg.com/media/CYdQktMWsAEI29_.jpg,11634.0,3129.0,3200901.0,,2016-09-30,20:33:43,11.0,Labrador_retriever,0.320012
781661882474196992,Who keeps sending in pictures without dogs in them? This needs to stop. 5/10 for the mediocre road https://t.co/ELqelxWMrC,None,https://pbs.twimg.com/media/CYdbvwjWcAEtjYu.jpg,4466.0,1314.0,3200901.0,,2016-09-30,01:08:10,5.0,Rottweiler,0.441331
781655249211752448,This is Combo. The daily struggles of being a doggo have finally caught up with him. 11/10 https://t.co/LOKrNo0OM7,Combo,https://pbs.twimg.com/media/CYeWlh0WAAADhsj.jpg,23163.0,6426.0,3200901.0,doggo,2016-09-30,00:41:48,11.0,Norwich_terrier,0.100499
781524693396357120,Idk why this keeps happening. We only rate dogs. Not Bangladeshi Couch Chipmunks. Please only send dogs... 12/10 https://t.co/ya7bviQUUf,None,https://pbs.twimg.com/media/CYfCMdFWAAA44YA.jpg,7973.0,2961.0,3200901.0,,2016-09-29,16:03:01,12.0,Tibetan_mastiff,0.338812
781163403222056960,"We normally don't rate lobsters, but this one appears to be a really good lobster. 10/10 would pet with caution https://t.co/YkHc7U7uUy",None,https://pbs.twimg.com/media/CYkON6CVAAAPXAc.jpg,24192.0,8536.0,3200901.0,,2016-09-28,16:07:23,10.0,Labrador_retriever,0.417107
780858289093574656,"This is Dash. He's very stylish, but also incredibly unimpressed with the current state of our nation. 10/10 would pet ears first https://t.co/YElO4hvXI6",Dash,https://pbs.twimg.com/media/CYka1NTWMAAOclP.jpg,6141.0,1505.0,3200901.0,,2016-09-27,19:54:58,10.0,borzoi,0.883086
780800785462489090,This is Koda. He has a weird relationship with tall grass. Slightly concerning. 11/10 would def still pet https://t.co/KQzSR8eCsw,Koda,https://pbs.twimg.com/media/CYkoE10WEAAWqxm.jpg,13525.0,3839.0,3200901.0,,2016-09-27,16:06:28,11.0,beagle,0.000216206
780601303617732608,Meet Hercules. He can have whatever he wants for the rest of eternity. 12/10 would snug passionately https://t.co/mH0IOyFdIG,Hercules,https://pbs.twimg.com/media/CYkrNIVWcAMswmP.jpg,7040.0,2032.0,3200901.0,,2016-09-27,02:53:48,12.0,pug,0.178205
780543529827336192,Here's a perturbed super floof. 12/10 would snug so damn well https://t.co/VG095mi09Q,None,https://pbs.twimg.com/media/CYnS9VWW8AAeR8m.jpg,0.0,4319.0,3200901.0,,2016-09-26,23:04:13,12.0,Great_Dane,0.139909
780192070812196864,We only rate dogs. Pls stop sending in non-canines like this Urban Floof Giraffe. I can't handle this. 11/10 https://t.co/zHIqpM5Gni,None,https://pbs.twimg.com/media/CYpsFmIWAAAYh9C.jpg,0.0,2655.0,3200901.0,,2016-09-25,23:47:39,11.0,English_springer,0.472273
780074436359819264,Here's a doggo questioning his entire existence. 10/10 someone tell him he's a good boy  https://t.co/dVm5Hgdpeb,None,https://pbs.twimg.com/media/CYsTg1XUsAEPjxE.jpg,21252.0,8237.0,3200901.0,doggo,2016-09-25,16:00:13,10.0,pug,0.957365
779834332596887552,This is Scout. He really wants to kiss himself. H*ckin inappropriate. 11/10 narcissistic af https://t.co/x0gV2Ck3AD,Scout,https://pbs.twimg.com/media/CYs3TKzUAAAF9A2.jpg,9831.0,3613.0,3200901.0,,2016-09-25,00:06:08,11.0,miniature_pinscher,0.956063
779377524342161408,Have you ever seen such a smol pupper? Portable af. 12/10 would keep in shirt pocket https://t.co/KsqaIzlQ12,None,https://pbs.twimg.com/media/CYuVi9pWwAAbOGC.jpg,0.0,21324.0,3200901.0,pupper,2016-09-23,17:50:56,12.0,Staffordshire_bullterrier,0.151113
